user_country,source,content,date
,Twitter for iPhone,Anyone who doesn’t see how #climatechange contributes to this shouldn’t drive a car. https://t.co/fRhBARWHNl,2020-10-22T23:59:51+00:00
,Twitter for Android,"😂😂 so funny  I don't know why he always has doubts by everyone who not with his way or against him, even science ..!!! They have a ""Political agenda"" He became sick 😷   #ClimateChange ☘ https://t.co/gqLPqKhVme",2020-10-22T23:59:51+00:00
Malta,Twitter Web App,“threatening the life of human society with nuclear war and climate change.” Somehow white ppl are shoving black People into vehicle exhaust pipes and raising further pollutions to add to the climate change. I don't know what to think about the nuclear war bit. It must be that,2020-10-22T23:59:44+00:00
,Twitter for Android,"@sarahcpr 😂😂 so funny  I don't know why he always has doubts by everyone who not with his way or against him, even science ..!!! They have a ""Political agenda"" He became sick 😷   #ClimateChange ☘",2020-10-22T23:59:31+00:00
Nevada,Twitter for iPhone,"With climate change feeding wildfires, cops instead focused on fanciful ""forest jihad"" threat, documents show https://t.co/kow4C5P8Ys by @mazmhussain",2020-10-22T23:59:19+00:00
,Twitter for iPhone,Climate change is a stupid topic.  #DebateTonight #Debates2020,2020-10-22T23:59:19+00:00
"San Pablo, CA",Twitter for iPhone,"@L_KaneHartnett @chipfoxx oh, don't mind me, i'm just gonna hang out here and wait for trump to blame it on colorado and deny climate change",2020-10-22T23:59:17+00:00
Auckland,TweetDeck,"Talk about a critical appointment: with @jamespeshaw not in cabinet, who should the new minister of climate change be?  And what approach should @nzlabour and @NZGreens take to each other anyway? My @nzherald column today, in the paper and premium online https://t.co/6y14l0CbLb",2020-10-22T23:59:14+00:00
"San Francisco, CA",Twitter Web App,Topics for tonight's #Debates2020:  Fighting COVID-19 American Families Race in America Climate Change National Security Leadership  #Vote2020 #vote,2020-10-22T23:59:03+00:00
,Zapier.com,What cold lizards in Miami can tell us about climate change resilience  https://t.co/dCUu65q9fA  #REFORM230 #REFORMSection230 #Freespeech,2020-10-22T23:58:44+00:00
Four Seasons Total Landscaping,Twitter for Android,@EHConspiracy It would have been SO EASY TO STEER THE SHIP LEFT on fracking with Science and Job Assistance and Retraining and Climate Change and instead they tried to kick the Republican football. Embarrassing.,2020-10-22T23:58:44+00:00
"Washington, DC",Twitter Web App,"We know the facts: the climate is changing and our health is on the line. So, how do we move forward?   Let's talk #climate #health and the role of #medstudents as change makers!   Thank you @jonasattilus @dbrendanjohnson for having me as a guest on this episode of @SocMedOnAir. https://t.co/9DC3LBA944",2020-10-22T23:58:42+00:00
,Twitter for Android,"When POTUS @realDonaldTrump is asked about climate change he should say if you believe in it, the best to fight it is bring jobs from China to Americas clean manufacturing processes. https://t.co/zpWzYsIkoO",2020-10-22T23:58:40+00:00
,Twitter for iPad,"@AnnCoulter No, they're just smart enough to know that the GOP will do anything to change the subject away from what the American people want to know about. They want to talk about Hunter Biden not about healthcare, or Covid, or climate change, or unemployment or race relations.",2020-10-22T23:58:40+00:00
"Melbourne, Victoria",Twitter for Android,@iMusing And no one in the OECD is under any misapprehension about Matthias and his govt's records on climate change.,2020-10-22T23:58:32+00:00
,Twitter for iPhone,Can I just ask... how do people not believe in climate change when it’s October in Indiana and it’s 75 degrees outside??,2020-10-22T23:58:29+00:00
"Minneapolis, MN",Twitter Web App,"As Comm. Bishop @lbishopw says, “A new generation of activists is standing up to tell us, the leaders, the govt, do something about climate change. We need to listen...""  Aaron, a medical student says we must #KeepItInTheGround   @MnPCA, deny the permits #StopLine3 https://t.co/3aUkxcszDj",2020-10-22T23:58:27+00:00
,Twitter for Android,"@MarkEHartman @NilesGApol Different environment, different democrats. Former GOP Bollier and Ind. Al Gross endorsed Medicare buy in. Not to mention policy proposals for climate change. With the exception of Sinema and Feinstein, all senators or candidates have punted on or endorsed ending the filibuster.",2020-10-22T23:58:25+00:00
"Trissur, India",Twitter for Android,@Timcast Trump is very much the establishment. Also fact checking is an objective thing like climate change.,2020-10-22T23:58:23+00:00
India,WordPress.com,"Climate change is a national security issue, experts warn https://t.co/Z6tnABCTdh",2020-10-22T23:58:22+00:00
,Twitter for iPhone,@TubboIsBaby @shortstos @Thrillist Great? All she has done so far is cry like a child pointing all the problems at trump while she is doing nothing and playing video games. I mean Remember how she was so for climate change? Yea last time I saw she was driving instead of using the subway like she told us.,2020-10-22T23:58:17+00:00
,Twitter Web App,@SteveNegronNH supports a president who mocks those who believe in science and climate change. @AnnMcLaneKuster has a plan for our environment that bridges the economic and conservation divide to create jobs AND saves the planet. The choice is clear. #NH02 #NHPolitics #WMURdebate,2020-10-22T23:58:15+00:00
Covfefe fund:,Twitter for iPhone,Climate change is just a Chinese hoax to sell more fire extinguishers! https://t.co/pVFMpWsIdY,2020-10-22T23:58:14+00:00
"Arlington, Virginia",Twitter Web App,@WhiteHouse @realDonaldTrump Our allies can't trust us. We threw the Kurds to the wolves for $$. China has taken the lead on health and climate change. Russian bounties on our soldiers go ignored.  We are a joke and the only thing we lead in is Coronavirus deaths. #Covid_19,2020-10-22T23:58:13+00:00
phx. chi. ,Twitter Web App,"bro how do you say ""facts over feelings"" and not believe in climate change",2020-10-22T23:58:03+00:00
Philippines,Twitter for iPhone,Growing more pechay instead  duting the harsh rainy season . #climatechange https://t.co/JaD6jan7JR,2020-10-22T23:57:57+00:00
"Racine, WI",Twitter Web App,She thought stalin's practices could help stem climate change https://t.co/MbMhazgIy3,2020-10-22T23:57:54+00:00
,Twitter for Android,"@TBG9270584 It has never been about the climate,  it has always been about controlling people with fear. Notice how climate change was forgotten the moment corona rears it head?",2020-10-22T23:57:50+00:00
,Twitter for iPhone,Say climate change is real and purely human caused. What could we do that wouldn’t bankrupt the US? How could we stop other countries like China? What if we let it take its course and deal with it when technology improves? I really don’t see any solution beyond the free market,2020-10-22T23:57:49+00:00
,Twitter for iPhone,"If you support “reforming the court” to rotate justices out after 9 years or something, that could be helpful in a decade or so but you would have to be really comfortable with the resilience of American democracy over the next decade, and also not believe in climate change",2020-10-22T23:57:48+00:00
,Twitter Web App,"@WorldWarZeroOrg ""[Ms. Coney's father] was an active member of the American Petroleum Institute, twice serving as chairman of its Subcommittee on Exploration and Production Law... API has played a critical role in casting doubt on climate science and opposing policies to address climate change.""",2020-10-22T23:57:41+00:00
Royaume-Uni,Twitter for Android,@shaylekann Thanks for sharing @shaylekann ! What are your views about the split between hardware vs software climate tech disruption? Do you think hardware will have harder times attracting capital? But will they be more powerful to tackle climate change? Very curious to get your opinion,2020-10-22T23:57:37+00:00
"San Diego, CA",Twitter for iPhone,@voxdotcom Covid: Trump failed to lead &amp; people died.  American families: trump cheated on Melania Race in America: trump is a #RacistInChief Climate change: trump doesn’t believe in science  National Security: trump is a Russian 🤖  Leadership: trump hired all the best people. Now in jail,2020-10-22T23:57:33+00:00
,Twitter for iPhone,"@darialadiosa UNPOPULAR OPINION (from a non vegan myself): It’s probably the more efficient way in stopping climate change compared to limiting fossil fuel usage.  My wife is a vegan, btw, even if I might be. I do enjoy the plant-based cuisines and certainly philosophies, nonetheless.",2020-10-22T23:57:20+00:00
your moms house,Twitter for iPhone,"no hate or anything but some people will rlly say ""there's only two genders, that's science"" then turn around and deny climate change",2020-10-22T23:57:12+00:00
,Twitter Web App,"@WorldWarZeroOrg Barrett: ""I'm certainly not a scientist. I have read things about climate change. I would not say I have firm views on it.""  She also claimed she doesn't know Trumps position on climate change.  We don’t need a climate denier and liar on the Supreme Court.",2020-10-22T23:57:11+00:00
Seattle ,Twitter for iPad,"Colorado is my home state, my dad still lives there. I asked him if the ppl he knows who deny climate change will change their minds now, he says nope probably not   #Colorado #ColoradoFires #EstesParkfires #TroublesomeFire #ClimateEmergency #EstesParkevacuation #ClimateCrisis https://t.co/xVPgxbYthG",2020-10-22T23:57:07+00:00
,Twitter Web App,"Kristen Welker, moderator, has selected the topics.  1)Fighting COVID-19 2)American Families 3)Race in America 4)Climate Change 5)National Security 6)Leadership  The debate will start at 9:00 p.m. ET and run for 90 minutes.   https://t.co/UbwZBMgxvi",2020-10-22T23:57:02+00:00
"Sydney,  AU",Twitter Web App,"@KleinRevd @ScottMorrisonMP @jacindaardern About as likely as him acknowledging the threat of climate change.   As he put,  ""I just learned not to care. """,2020-10-22T23:57:02+00:00
,Twitter Web App,"@Dank_H2O @pppapin @ColoradoClimate Exactly. California burned an estimated 4.5 million acres every. single. year. prior to 1850, but modernists try to pawn these large fires off as humanity's fault.  And they are humanity's fault: poor forest management and aggressive modern firefighting - not climate change.",2020-10-22T23:56:56+00:00
Hong Kong,Twitter for iPhone,Attenborough polar ship sets sail for Antarctica Are these scientists prepared to tell us the truth? Even if the truth is opposite to the claim of climate change?  https://t.co/HNMp9bASXi,2020-10-22T23:56:40+00:00
"Nassau, Bahamas",Twitter for Android,"Ginger Zee may look like a parody of herself right now, but I love her breakdown of climate change.",2020-10-22T23:56:28+00:00
,Twitter for iPhone,Fuck me ABC News is explaining climate change to the American people like they are a bunch of grade 2 kids 😭😭😭,2020-10-22T23:56:23+00:00
"Taipei, Taiwan",Twitter for iPhone,"“And our approach to China will focus on boosting American competitiveness, revitalizing our strengths at home, and renewing our alliances and leadership abroad. We'll work to collaborate with China when it's in our interest, including on public health and climate change.”",2020-10-22T23:56:11+00:00
Southeast Michigan,Sprout Social,"Bacteria is a bellwether for climate change and they’re multiplying and moving into new places, sickening people who swim, fish and work in coastal waters. #climatechangeshealth. @kresgenviro https://t.co/iMw7XYmd6d",2020-10-22T23:56:00+00:00
Philippines ,Twitter for iPhone,"@gmanewsbreaking @gmanews @_jamesJA Caused by lack of proper urban development, lack of discipline in trash and garbage disposal, drainage system get plug up, and climate change",2020-10-22T23:55:58+00:00
Hollis NH,Twitter Web App,"More bad questions from @WMUR: COVID, Gun Grabbing, Fairy Tale about Climate Change, Work Together (impeachment for nothing), what about fiscal discipline? &lt;crickets&gt;  #NHPolitics #NH #NH02 #NHPolitics https://t.co/CWZP0VXJ6r",2020-10-22T23:55:56+00:00
she/her || 15  || sisters 💜,Twitter for iPhone,MY TRUMPIE GRANDMA JUST TRIED TO EXPLAIN TO ME THAT CLIMATE CHANGE ISNT REAL AND SCIENTISTS LIE ABOUT FACTS ALL THE TIME I CANT IMMA ZAYN OUT OF THIS FAMILY,2020-10-22T23:55:48+00:00
,Twitter Web App,@catturd2 4 Seasons ... Climate changes.,2020-10-22T23:55:43+00:00
"Fort Collins, CO",Twitter Web App,Record-setting conditions creating unprecedented destruction. This is the signature of climate change https://t.co/Ru0WhXYQa3,2020-10-22T23:55:41+00:00
Israel,IFTTT,Israel and Germany are joining forces to fight climate change! 🇮🇱🌳🇩🇪 https://t.co/yXtaVpvV4h,2020-10-22T23:55:25+00:00
 ,Twitter Web App,@jimac111 @gavindjharper No doubt the children of the Coal Not Dole generation will be joining Extinction Rebellion campaigning against the use of coal and other fossil fuels due to climate change!,2020-10-22T23:55:19+00:00
"Osaka, Japan",Buffer,@exxonmobil has misled the public for years with disinformation campaigns to sow doubt into the science behind #ClimateChange. The age of fossil fuels is over. Time to fix the damage we've done. #ClimateEmergency #ClimateCrisis   https://t.co/oMMc086GGZ,2020-10-22T23:55:01+00:00
"Seattle, WA",Sprout Social,The debate on climate change has been an embarrassment. Here's how Kristen Welker can up the ante. https://t.co/py3SsWgocK,2020-10-22T23:55:00+00:00
"Calgary, Mtn Standard Time",Twitter for Android,Biden voted against one Iraq war and then for another one... Negotiated for passage of Russian nuclear arms treaties three decades apart... And was pushing climate change legislation back when Trump was still with Ivana. https://t.co/Q89KzDn54D,2020-10-22T23:54:57+00:00
,Twitter for Android,Angela Keller-Herzog asks about budget allotments addressing climate change and transit's role in that.,2020-10-22T23:54:54+00:00
New Hampshire,Twitter Web App,"This isn't hard: climate change is real, and we must take action.  While Steve Negron supports a president who's a climate change denier, @AnnMcLaneKuster understands the importance of this crisis — it's why she was endorsed by @SierraClub and @LCVoters. #NHPolitics #WMURDebate https://t.co/QwGyOc43VA",2020-10-22T23:54:47+00:00
"Canberra, Australia",Twitter for Android,"@PatrickPentony Because the Canberra Liberals are hostile to acknowledging climate change is happening and humans are responsible, anyone who says so is pushed out. This explains at least some of the swing away. Zed, Manuatu etc are all aggressive fossil fuel lobbyists.",2020-10-22T23:54:45+00:00
"Concord, NH",Twitter Web App,"Protecting our planet and combating the effects of climate change does not have to come at the cost of the economy—we can build the clean energy economy of the future, together. That's what I'm fighting for every day in Congress. #WMURDebate #NHpolitics https://t.co/mG1aSxLfO4",2020-10-22T23:54:43+00:00
,Twitter for iPhone,Please watch the new documentary with David Attenborough on Netflix! And listen to Nahko and medicine for the people! #climatechange,2020-10-22T23:54:38+00:00
"Washington, D.C.",Twitter for iPhone,"The 6 topics for the final face-off between #Trump and #Biden: fighting #Covid19, American families, #race in America, #climatechange, national security, and #leadership. #Debate2020",2020-10-22T23:54:36+00:00
United Arab Emirates ,Twitter for Android,So Congo people end up burning wood and charcoal to produce energy to cook and everything which emits a lot of greenhouse gases.   This is how poverty results in accelerating climate change.,2020-10-22T23:54:35+00:00
"Newark, 3rd oldest big US city",Twitter for Android,@realDonaldTrump has an excellent foreign policy. His economic recovery since covid is spectacular.  Unemployment is down to 7%.  Neither topic will be covered at #DebateTonight . *Family *Coronavirus *Race *Climate Change *National Security *Leadership  Another #ProBidenSetup!,2020-10-22T23:54:29+00:00
The Greatest Nation on Earth,Twitter for iPad,@amandacarpenter Democrats 2016: Global Warming! Racism! Russia! Democrats 2020: Climate Change! Racism! BLM! Russia! Masks!  Everyone else: #BidenCrimeFamiily #EpsteinDidntKillHimself #Anitifa #ViolentLeft #BLMRiots #AllLivesMatter #BackTheBlue #KAG 🇺🇸🇺🇸🇺🇸🇺🇸🇺🇸🇺🇸🇺🇸🇺🇸🇺🇸🇺🇸🇺🇸🇺🇸🇺🇸🇺🇸🇺🇸🇺🇸🇺🇸🇺🇸🇺🇸,2020-10-22T23:54:28+00:00
"Saint-Valery, France",Twitter Web App,@JoanieLemercier And climate change intensified by wildfires.,2020-10-22T23:54:24+00:00
California,Twitter for iPhone,@ColoradoSun Sending my prayers to Colorado 🙏  As a Californian I’ve been through these wildfires &amp; they’re terrible!   Also We’ve seen the worst fires ever in 🇺🇸 but Trump blamed raking leaves instead of science &amp; #ClimateChange   Let’s all #VoteHimOut so we can save America. #VoteBlue,2020-10-22T23:54:20+00:00
,Twitter Web App,"2019 was second-warmest year on record https://t.co/BiFrCoAaUX , and 2020 should have been a ""normal year"" - - it isn't.  Don't take the bait and run town a rabbit hole - climate change isn't about data regarding a SINGLE impact, rather all the data and all the impacts.",2020-10-22T23:54:00+00:00
,Twitter Web App,"still pretty worried about this ""climate change"" thing. has somebody fixed that yet?",2020-10-22T23:54:00+00:00
"Melbourne, Victoria",Twitter for iPhone,@MicheleS_Aus @JonesHowdareyou @deniseshrivell Except for James Murdoch he left the organisation over Climate Change intentional misinformation and denial in protest.  Well done! James Murdoch!👏🇦🇺,2020-10-22T23:53:49+00:00
Japan,Twitter for iPhone,"Why can’t the big businesses here use their knowledge, technique and money to do something more about the environment and #ClimateChange ?",2020-10-22T23:53:47+00:00
"Victoria, Australia",Twitter Web App,People think climate change is an issue except its not its just  the way the planet works there is no problem there and people that believe Humans can change the planet are just being completely stupid,2020-10-22T23:53:44+00:00
"Greatest Country, USA",Twitter for iPad,"the moderator of tonight’s presidential debate, Kristen Welker, has instead provided a list of “off-topic topics.” They include COVID, American families, race relations, climate change, national security, and the most ephemeral topic of all: “leadership.” https://t.co/rgm3FAlH52",2020-10-22T23:53:35+00:00
Trinidad and Tobago,Twitter for Android,"@TheOliverStone Climate change is real, it's globalist proponents are selective with their ""C02 science"" and  their regulatory framework,  Trump's stance on immigration is influenced by the repatriation of overseas mercenaries to the US by security state provocateurs. Re military buildup dsagree",2020-10-22T23:53:32+00:00
London,Twitter for iPhone,"@JustinWolfers Yes, but also something we should teach quite young children; and increasingly do, in the context of protecting the environment and climate change.  Many of us learnt as kids about externalities - tho not the name - eg when taught why not to litter, or shout in restaurants.",2020-10-22T23:53:27+00:00
Washington State,Twitter for iPhone,"Washington was the leader in climate change reform. We are losing ground, and jobs to other states by falling behind! https://t.co/Bh7gBnLt4d",2020-10-22T23:53:25+00:00
USA,Hootsuite Inc.,"In October, we worked with the office of  @repbenraylujan to schedule a meeting to share information about our work, and our perspectives about what we’re seeing as it relates to climate change.  Catch up on our visit with Congressman Luján  &gt;&gt;&gt; https://t.co/S9ea0FGdQ1",2020-10-22T23:53:20+00:00
"Washington, USA",Twitter for iPhone,"@Nitrofish904 @Liberatedin44 Seriously though, is it worse than Seattle? We literally have the worst governor in the country according to the CATO institute. A RINO has got to be better than idiot climate change, closet socialist. Right?",2020-10-22T23:53:17+00:00
United States,Twitter for iPhone,@suzanne73863722 @HannahCox7 3/ 66-70% of Americans believe in stricter gun control laws. I doubt this court will reflect that opinion.  77% say abortion rights should stay legal and safe. 67% say the government is not doing enough to protect us from climate change.,2020-10-22T23:53:12+00:00
,Twitter Web App,@jpgolf416 @aalkaltham @sarahcpr The magnetic north pole has shifted. The glaciers have NOT shifted from their position relative to the earth's axis. I.e. no climate change from a shifted axis.,2020-10-22T23:53:12+00:00
"New York, NY",Buffer,"At 7PM PT today, from our Editors’ List for #LosAngeles: 'Climate Change and the Next Ten Years' by @InnovatPasadena - Presented by @AaronFyke  | https://t.co/mHO6znczPx - #climatechange https://t.co/MHHdv7FWkK",2020-10-22T23:53:02+00:00
"East Coast, USA",Twitter Web App,"What topics has moderator Kristen Welker chosen to cover?   Fighting the coronavirus, American families, race in America, climate change, national security and leadership. https://t.co/9WrotiKBtC",2020-10-22T23:53:01+00:00
United States,Twitter for iPhone,@callykarishokka Climate change probably,2020-10-22T23:52:58+00:00
Republic of the Philippines,Twitter for Android,Okieee good luck to us all world. This one appointment will ruin climate change policy for a generation. Good job conservatives for ruining everything 👏 https://t.co/ZjRbOQLq2R,2020-10-22T23:52:53+00:00
Melbourne,Twitter Web App,"The second question at the Worley AGM was from Rachel Deans, a climate change campaigner with Market Forces (associated with Friends of the Earth). It was a long question and the billionaire chair got a PR person to read it out https://t.co/6ebOrlQzqQ",2020-10-22T23:52:51+00:00
Earth!,Twitter for iPhone,But climate change is a hoax...yeah...#VoteEarly #VoteJoeBiden https://t.co/VlBDOWSHW3,2020-10-22T23:52:37+00:00
,Twitter for iPhone,"I know I’ve said this ten hundred times but, this is the same as saying you don’t want to pass any legislation to improve people’s lives or stop climate change, and that you’re content to see the courts strike down voting rights, marriage equality, reproductive rights, etc https://t.co/APeKzh5au9",2020-10-22T23:52:31+00:00
"Minneapolis, MN",Twitter for iPhone,@MattWalshBlog And.....”So you’re saying that climate change isn’t real?” “So you want the forests to keep burning in California?”,2020-10-22T23:52:30+00:00
,Twitter Web App,"@senatemajldr Barrett: ""I'm certainly not a scientist. I have read things about climate change. I would not say I have firm views on it.""  She also claimed she doesn't know Trumps position on climate change.  We don’t need a climate denier and liar on the Supreme Court.",2020-10-22T23:52:25+00:00
Scotland,Twitter for iPad,What’ya mean I make you think of climate change? https://t.co/EhvSiXvlt4,2020-10-22T23:52:23+00:00
,Twitter for iPhone,I've offset 0 lbs of CO2 for free by spending with Mogo. Join me to help stop climate change! https://t.co/AOE02LxiyP,2020-10-22T23:52:10+00:00
Samoa,Twitter Web App,"Samoa's largest climate change adaptation project, the Vaisigano Catchment Project, is featured in this story 🔽.   Funded by the @theGCF and @samoagovt, the project builds integrated &amp; comprehensive flood management solutions, and will benefit 30% of the population. https://t.co/nWBSvSms9O",2020-10-22T23:52:09+00:00
Vancouver,TweetDeck,"Even if you're not ecosocialist, as I am, you still can't really argue that this NDP bunch are environmental stewards, great friends to labour, or remotely interested in addressing the twin &amp; intertwined crises of inequality and climate change.   They don't deserve a majority.",2020-10-22T23:52:05+00:00
,Twitter Web App,"@RepAdamSchiff Barrett: ""I'm certainly not a scientist. I have read things about climate change. I would not say I have firm views on it.""  She also claimed she doesn't know Trumps position on climate change.  We don’t need a climate denier and liar on the Supreme Court.",2020-10-22T23:52:01+00:00
Tokyo,Buffer,Researcher: Electric Cars Aren’t the Answer to Climate Change https://t.co/ZTv2PYlYhg (Futurism),2020-10-22T23:52:00+00:00
"Toronto, Canada 🇨🇦",Twitter Web App,This is really good. 👇Hope  more companies would  follow  this  example  to reduce impact  on  climate change and reduce  carbon emissions. https://t.co/RDj2cFJXZY,2020-10-22T23:52:00+00:00
Australia,Twitter for iPhone,Daniel Andrews has given many ppl a sense of hope. Watch him act when we achieve a Covid normal. He will invest in what is needed to support all of us - and help to tackle climate change. He is the IPALNP worst nightmare. https://t.co/C40pOc5MJX,2020-10-22T23:51:59+00:00
,Twitter for iPhone,@SevenSvava @crobb203 @DailyCaller Climate change might be the worse of all of them. We’re dealing with the worst pandemic the country’s every seen and Dems want to talk about “man made global warming.” As if the avg American is stressing over that.,2020-10-22T23:51:44+00:00
,Twitter for iPhone,"@CortesSteve Climate change should start at the top. To all the billionaire elites who are concerned with climate change, there should be no more flying in and out on your private jets, instead we should all be flying on commercial airlines to our destinations. Yachts too!",2020-10-22T23:51:39+00:00
"East, England",Twitter Web App,"Apparently I missed this @StoryBoardGamer article from couple of years back, or I might have been less bestonked:  https://t.co/VimFnWeF7u  See also any search for ""Phil Eklund"" ""climate change""",2020-10-22T23:51:33+00:00
