user_country,source,content,date
"Ottawa, ON",Twitter for iPhone,Rogues Gallery of Folk Who are Culpable in Destroying Our World With No Substantive Action on Abrupt Climate Change:  Makes you feel like you are on the Titanic!!  https://t.co/IwcFPXKFAR  #ClimateAction #ClimateEmergency #ClimateChange #climate #cdnpoli #USA #uspoli #Weather https://t.co/5EIZOLL91b,2020-10-22T23:12:37+00:00
"Edinburgh, Scotland",Twitter for iPhone,@aalkaltham @sarahcpr Jfc modern humans don’t even exist on the geological timescale that natural climate change works on,2020-10-22T23:12:36+00:00
Brisbane,LinkedIn,Impacts of #climatechange on #property prices have been witnessed in Florida. We've already seen the implications for insurance here in Australia- will prices be impacted next? https://t.co/4U7WXYdxu1,2020-10-22T23:12:23+00:00
,Twitter Web App,The only way to avoid catastrophic climate change is a shift to a new social and economic framework called “degrowth”— where “growth-oriented economies evolve towards a new system that fulfills human needs without the necessity for continuous growth.”   https://t.co/aQfxZDp7tr,2020-10-22T23:12:20+00:00
,Twitter for iPhone,"@realDonaldTrump @DonaldJTrumpJr @LaraLeaTrump @EricTrump @JasonMillerinDC @mercedesschlapp Frank Lutes focus group has questions for Biden. Will taxes go up, will you pack the court, cost of climate change. They don’t seem to care abt Hunter, they are worried abt their own lives",2020-10-22T23:12:13+00:00
America land of the free!,Twitter for iPhone,@BlackPatriot77 I like climate change deniers. God bless,2020-10-22T23:12:06+00:00
,"Cheap Bots, Done Quick!","The twentieth generation will be the inorganic, senseless children we thought were lost to climate change.",2020-10-22T23:12:02+00:00
"Chicago, IL",Twitter Web App,"What happens when art and science meet? Sculptures made from plastic bottles and beeswax, real mold in a collage and a massive monarch butterfly. Third Coast Disrupted aims to start a discussion about climate change and solutions. (By @natalie_eilbert)  https://t.co/3LKluYopYj",2020-10-22T23:11:59+00:00
,Instagram,"This is my dog now. #tgsatterwhite • • • Vote if you’re able, wear y’mask, Black Lives Matter, climate change is real, water is life, please think of others. Love you 🖤 https://t.co/1rK80Sq5uV",2020-10-22T23:11:58+00:00
,Twitter for Android,"Councillor Jean Cloutier commends Diane Deans' leadership on the OPS Board. Lists crises: COVID, housing, and climate. Acknowledges defunding the police cry and ruling re: Abdirahman Abdi. Points out we need to change and that the appropriate call isn't always a badge and a gun.",2020-10-22T23:11:56+00:00
,Twitter Web App,"@JournalStarNews Because it’s cheap energy! Solar &amp; Wind can’t deliver or provide reliability we need. CO2 emissions in the USA have declined. Climate change is about money, power pushed by liberal left. #ClimateChange is a scam!",2020-10-22T23:11:54+00:00
,Twitter for Android,can't believe ppl still think climate change is fake.....,2020-10-22T23:11:29+00:00
more @nexterasounds,Twitter for iPhone,https://t.co/P6PgDSixck Artist INTELLECT Track Climate change Year 2018,2020-10-22T23:11:28+00:00
Earth,Twitter for iPhone,This is an extraordinary turn of events. Curious if this comes up in the debate tonight. America’s u-turn on climate and environmental regs has huge implications for energy security and international trade #Debates2020 #ClimateChange #energytwitter https://t.co/qaou2EXruG,2020-10-22T23:11:25+00:00
Purim 5779,Twitter for iPhone,@ztsamudzi His arguments as I understand them are that Holocaust denial should not be vilified more than other denials (eg climate change) &amp; that if you are committed to truth then you should welcome the attempts by H deniers to ferret out inconsistencies in your understanding of the truth,2020-10-22T23:11:21+00:00
Canada,Twitter for iPhone,How the US could lead on climate change — in 8 simple steps https://t.co/qmAfihoMQ1,2020-10-22T23:11:21+00:00
"Washington, DC",Twitter for iPhone,"@SenateDems @SenSchumer religion shouldn’t be a factor, but I wldnt call voting 85% of the time for corporations over workers Christian, stickler-critiquing Roberts’s generous vote to uphold millions of people’s health care pro-life, failing to aver the science of climate change pro-tending God’s Garden",2020-10-22T23:11:19+00:00
,Twitter for iPhone,even the eastern half of colorado is on fire now so i guess i’ll move to montana and hope climate change warms it up a little,2020-10-22T23:11:18+00:00
"Portland, ME",Twitter for iPhone,.@LisaForMaine right out of the gate is making clear what issues she’s most passionate about: climate change and health care. #voiceofthevoter @newscentermaine,2020-10-22T23:11:10+00:00
"Maryland, USA",Hopper HQ,"Rising water levels on the Chesapeake affects all of MD! I will fight for measures to address climate change! I need your donations to win this election &amp; give you the representation you deserve!  $5, $15, or anything you can afford is appreciated!  https://t.co/gQ93neC1gP https://t.co/jqtXhFX3Au",2020-10-22T23:11:05+00:00
,Twitter for iPhone,Climate Change Is Killing the Cedars of Lebanon - The New York Times https://t.co/Xzivg4GacE,2020-10-22T23:10:53+00:00
,Twitter for iPad,"Do you know, you can save baby orangutans’ life, stop deforestation and save our planet if you stop eating meat! 😳🥒🥬if you want to learn more watch David attenborough, A LIFE ON OUR PLANET documentary @netflix #DavidAttenborough #ClimateChange #ClimateAction #orangutan https://t.co/rgsDoMCXJu",2020-10-22T23:10:50+00:00
"Ahmednagar MIDC, Ahmadnagar",Twitter for Android,Millions miles of journey begins with a single step... Zero waste lifestyle.... to protect environment...must watch beautiful speech at Tedx by Lauren Singer  https://t.co/isy1lnV4Ob  #ClimateAction  #ClimateChange  #EnvironmentalJustice  #TuesdayThoughts,2020-10-22T23:10:45+00:00
,Twitter for Android,"@BruceCordell Mine would be voting rights and disenfranchisement, but that's mostly because i think if we had better representation we'd act on climate change, Healthcare,  etc.",2020-10-22T23:10:42+00:00
"Mequon, WI",Twitter for Android,Fact: #BidenCrimeFamiily has taken tens of millions of dollars from China.  Impact: Joe Biden will not hold China accountable for #HumanRightsViolations  #pollution that causes #ClimateChange #TradeViolations #CorporateEspionage  Or any other international issue.,2020-10-22T23:10:39+00:00
,Twitter Web App,"anyways, climate change is real and affects real people please vote for the candidate who will take the proper steps for protecting our environment and its people etc etc",2020-10-22T23:10:36+00:00
"""His bepis is like eighty mile",Twitter Web App,@ishapiro @jessewegman the complete right wing control of government going back decades has consequences. you better keep your guards real fat and happy as climate change picks up or they'll democracy you onto the menu,2020-10-22T23:10:26+00:00
"Forsbrook, England",Twitter for iPhone,@LordBluntwell She looks like a climate change fanatic! Doubt you’ll miss much,2020-10-22T23:10:23+00:00
America,Twitter Web App,@NYPlantings I actually have a group that support #trees and I volunteer and plant trees every fall in my area. It is one of the easiest and most effective things people can do to combat #climatechange.,2020-10-22T23:10:17+00:00
"Medford, OR",Twitter for Android,"@OregonGovBrown Wow @OregonGovBrown I read each &amp; every comment posted AND NOT ONE AGREED WITH YOU. Both people who agree &amp; disagree about climate change ALL agreed you have your priorities wrong, as usual. I can't figure out if you're that dumb or just don't care what's best for Oregon.",2020-10-22T23:10:11+00:00
Minneapolis/St. Paul,Twitter for iPhone,UNCLE MIKE’S WINTER SURVIVAL TIPS: When the weather is below freezing and the ground is covered with snow it’s a good time to shut off your automatic lawn sprinklers.  #WinterIsHere #ClimateChange #ConserveWater,2020-10-22T23:10:05+00:00
,Hootsuite Inc.,"Canada: Climate change driving food insecurity in First Nations while government stands by, report says || By Ryan Patrick Jones https://t.co/2x3zoJL57Z",2020-10-22T23:10:05+00:00
,Twitter Web App,"@FinancialReview Environmental scientists in Australia say that they are under increasing pressure from their employers to downplay research findings on issues such as threatened species,urban development,mining,logging and climate change had become worse in recent years.  https://t.co/2FTI4MjQOm",2020-10-22T23:10:03+00:00
,Twitter for Android,"@MikeyRWoods @JamieLiz17 @PatriotKramer @KamalaHarris I don't really know what you mean. How can I be biased when I never even expressed an opinion one way or another? Don't you think teachers already teach facts, like climate change is real, being gay is not a choice etc.?",2020-10-22T23:10:01+00:00
Melbourne,Twitter Web App,Maybe why she thinks climate change science is contestable https://t.co/1y6BL4KTe0,2020-10-22T23:09:58+00:00
The University of Sydney,TweetDeck,Calls for Australia to introduce a 'Pacific Access visa' for islanders on the frontline of climate change: https://t.co/DluDDr1Xw6 #climaterefugees #migration #climatechange #climatecrisis #climateemergency #geopolitics #sustainability,2020-10-22T23:09:56+00:00
"Indiana, USA",Twitter Web App,"""The Right denies science""  Science:   Says there can be more than two genders, says it is possible for a man to become a woman and vice versa, does not consider a human embryo to be human, claims that we will not exist in 10-12 years due to ""climate change"" (list goes on).",2020-10-22T23:09:40+00:00
The World,Twitter Web App,But but but It Must be climate change as fires don't occur without climate change https://t.co/9ckma9eJ0r,2020-10-22T23:09:40+00:00
"Portland, Oregon",dlvr.it,Oregon high court rejects youth bid to force action on climate change: The court wrestled with declaring a state fiduciary obligation to safeguard a wide range of “public trust” resources. https://t.co/TJ85m9e5FK,2020-10-22T23:09:32+00:00
"Portland, OR",TubeBuddy,"I will be live tonight at 6pm PST for ""Trump vs Biden: Round 2"" RT and share with your friends.  #Trump #Biden #PresidentialDebate2020 #COVID19 #AmericanFamilies #RaceInAmerica #ClimateChange #NationalSecurity #Leadership #ForeinAffairs #HunterBiden   https://t.co/C2irXuQJ5T https://t.co/otgUE7dKAL",2020-10-22T23:09:23+00:00
USA,Twitter for iPhone,@OregonGovBrown Please don’t waste anymore taxpayer money trying to control climate change. You have no clue what you are doing.,2020-10-22T23:09:14+00:00
Dja Dja Wurrung Lands,Twitter Web App,"@Kon__K @murpharoo If they can personally profit from combating climate change then I'm at a point where I'm honestly ok with it, as long as it just gets fucking done. Watching them deny, obfuscate, ignore, block, twist, lie, etc. for the last 35 years since I've been aware of this shit is... 🤬",2020-10-22T23:09:14+00:00
"Local, regional, international",Twitter for Android,"MK are finalists in UNAWA Environment Awards. Kids tackling the big issues in WA and Indonesia. Waste, climate change and deforestation on their minds. Big announcement tonight. @HonJulieBishop @craigreucassel @damongameau @tomjd @UNESCO @ABCEducationAU @rmckean @BellasChallenge https://t.co/hjXs0XIa6w",2020-10-22T23:09:10+00:00
Middle of  New England,TweetDeck,"Please stop using the word ""believe"" in the same sentence as ""Climate Change"". Use the word ""understand"" instead. And make them explain if they claim to. Dammit.",2020-10-22T23:09:05+00:00
España,Twitter Web App,We need to protect planet We need politic action. No more sleeping abput climate change   Choose #BidenHarris2020 #joebiden for president  #Debates2020 https://t.co/8kUuolTaXi,2020-10-22T23:08:43+00:00
TX,Twitter for Android,@JonDArsen @SteveDucey @WajahatAli so what the methane fracking releases doesn't count? democrats value their pockets more than the environment. if you want to advocate for Biden I suggest not bringing up his approach to climate change,2020-10-22T23:08:39+00:00
"Houston, TX",TweetDeck,"Energy policy and climate change have played a bigger role in this year's debates, as @krbuckle reported. https://t.co/zetSYCx7yf",2020-10-22T23:08:34+00:00
,Twitter for iPhone,These market impacts will make climate change even more real for residents. https://t.co/RPNuUGKU4A,2020-10-22T23:08:25+00:00
,Twitter for Android,@Eyetin2floh Not American and don't care. Let me demonstrate what a cliche you are.  You are: Christian  Right wing  Trump supporter Anti vax Climate change denier Creationist,2020-10-22T23:08:24+00:00
"New York, New York",Buffer,"Climate change is arguably the biggest issue we're facing today, but how are corporations working to solve it? Ecoplant is helping industrial facilities optimize energy consumption  using artificial intelligence.  To read more, head over to https://t.co/ckAQnHSdBb https://t.co/rWYm7jDAVR",2020-10-22T23:08:23+00:00
,Twitter Web App,@debates  CPD's subject are catered towards @JoeBiden. Nothing about international politics so @realDonaldTrump cannot tell about his peace deals in the ME? Nothing on economy?   Fighting COVID-19 American Families Race in America Climate Change National Security Leadership https://t.co/yMrETUIxcj,2020-10-22T23:08:19+00:00
Sandbox Empire,Twitter for iPhone,@supernuggliona She also used to tell all of us how climate change is a liberal hoax so definitely a trashperson,2020-10-22T23:08:14+00:00
Washington State,Twitter Web App,"Have some time from 4-6PM tomorrow? Join our phone bank to call Washington residents and tell them that #WACantWait to update the GMA to address climate change, housing affordability, and environmental justice! https://t.co/FYVU4VvRgz",2020-10-22T23:08:07+00:00
where ever vermin are found,Twitter for iPhone,"@haggholm @rrr0cket @Phatthor1 @lydiasigo @ItsDanSheehan You're talking about 10,000 years of ecological stability, contributory negligence to a handful of extinctions, probably planet-fatal anthropogenic climate change, and the genocide of an entire continent and going ""woah woah, hold up, there's good and bad in everyone""",2020-10-22T23:07:59+00:00
,Twitter for iPad,"When asked about Climate Change, Trump should say the bigger threat to America is what the left will do, if they are given power! He wins the election at that moment.  @KellyannePolls  @JasonMillerinDC",2020-10-22T23:07:45+00:00
"Australia, Planet Earth",Twitter Web App,"@Reuters Great, a judge who doesn't believe in the evidence of climate change. Goodbye, USA.",2020-10-22T23:07:39+00:00
"Colorado, New York",Twitter for iPhone,@RepPerlmutter Then please work to fix this congressman - a key underlying cause of these fires in Colorado: extreme to exceptional drought brought on partly by climate change. https://t.co/e9wBitbr73,2020-10-22T23:07:28+00:00
Mexico city,Twitter for Android,"@Deepneuron Great question.   Maybe because he was naturally 'radicalized' in becoming a full-blown skeptic by way of peer-pressure. I remember for instance how there was a time when he voiced his doubts about climate change, and the pressure from his colleagues forced him to recant.",2020-10-22T23:07:19+00:00
"Clifton  Park, NY",Twitter for Android,@theorbitter @LKrauss1 I'm gonna vote for the guy who actually believes climate change is a real thing.,2020-10-22T23:07:17+00:00
"Midland, MI",Twitter Web App,Historically significant: Climate change is on the agenda for the final Biden-Trump debate. https://t.co/d1dgsek1DF,2020-10-22T23:07:13+00:00
The Ecopocalypse,Twitter for iPhone,"didn’t know there was a debate tonight, on climate change especially. thank fucking god my tv ain’t workin rn",2020-10-22T23:07:13+00:00
"NW Washington state, USA🇺🇸",Twitter Web App,"@FrankLuntz @latimesopinion To Undecideds: 1. Yes, Biden will raise your taxes: $4 trillion dollars. 2. Yes, your cost of living will rise dramatically.  No more affordable gasoline! 3. Biden cannot do better than Trump has done on COVID. 4. Yes, Biden's climate change agenda will cost trillions of dollars!",2020-10-22T23:07:05+00:00
,Twitter for iPhone,‘It’s a sea change’: How climate went from the back burner to a central issue in this year’s debates https://t.co/WJVRP5Zp7n,2020-10-22T23:06:59+00:00
,Twitter for Android,@Hayface00 @Dontnutbro @litesnek @SingSolidarity @existentialcoms way less than half lol look at popular vote (not defending the idea that democratic workplaces helps climate change idk who the fuck thinks that),2020-10-22T23:06:55+00:00
"San Diego, CA",Twitter for iPhone,"I don’t see “Bad things Obama said about me!” Or “Leslie Stahl was a meanie!” here anywhere? The topics for discussion over 90 uninterrupted minutes: 9 p.m. ET,  ""Fighting COVID-19,"" ""American Families,"" ""Race in America,"" ""Climate Change,"" ""National Security"" and ""Leadership."" https://t.co/OMnyF3gURU",2020-10-22T23:06:50+00:00
United States,Twitter Web App,Tonight's #PresidentialDebate topics include:  - Fighting COVID-19 - American families - Race in America - Climate change - National security - Leadership  Wanna get some reading in before the debate? Start here with candidates on the issues: https://t.co/X59KoZQdza #Debates2020 https://t.co/jPl6PnIyIQ,2020-10-22T23:06:41+00:00
"Washington, DC",Twitter Web App,"On the other hand, @JoeBiden recognizes the reality of our circumstances and doesn’t hide from the facts. He is committed to fighting for you and your family.  On COVID-19, on climate change, on injustice and more, Joe will fight and he has a plan to win.",2020-10-22T23:06:39+00:00
"Washington, DC",Twitter Web App,"This was supposed to be the third debate, but Trump backed out of last week's event after it was moved to a remote format following his coronavirus diagnosis.  Tonight's six topics: Fighting COVID-19 American families Race in America Climate change National security Leadership",2020-10-22T23:06:39+00:00
Portugal,Twitter Web App,Temas:  1. Fighting coronavirus  2. American families 3. Race in America 4. Climate change 5. National security 6. Leadership,2020-10-22T23:06:27+00:00
,Twitter for iPhone,I’ll make a bet with you @realDonaldTrump will not answer any of these questions or offer solutions.  following topics : •Fighting COVID-19 •American Families •Race in America •Climate Change •National Security •Leadership,2020-10-22T23:06:21+00:00
"Wadawurrung land, Ballarat VIC",Twitter for Android,"@GretaThunberg speaks for the generation who will inherit the messy consequences of our corporate and political inaction on #ClimateChange. Through this biopic, that generation get to be heard. As they should. https://t.co/IFftOeUHdg",2020-10-22T23:06:17+00:00
United States,Twitter for iPhone,Very cool that climate change is still considered a debatable topic.  https://t.co/nV3tRvH1rx,2020-10-22T23:06:17+00:00
"Ontario, Canada",Twitter for iPhone,ExxonMobil misled the public about the climate crisis. Now they're trying to silence critics | Climate change | The Guardian https://t.co/uwbPvIGv9K,2020-10-22T23:06:11+00:00
"Porirua City, New Zealand",Buffer,"#ClimateChange  Rising sea-levels, changing weather patterns, and more frequent, stronger storms will impact our economy and our natural environment.   Porirua City Council is seeking your input into its climate change strategy via a survey this month. https://t.co/FOqUOUaagR https://t.co/CPm7yoUrqJ",2020-10-22T23:06:11+00:00
"London, UK",Twitter Web App,"This is what they do, if you try and speak out.   The below was taken from the comments in the video.  ""Malcolm has been blacklisted and hounded by the MSM (also climate change fraud), he is against the global agenda and is everything for Australia.""",2020-10-22T23:06:04+00:00
Brooklyn,Twitter Web App,"@OvigweEguegu Australia is stuck in the position where it needs China to economically recover but is forced by the American security bubble to not stray from orders. I don't see the next thirty years looking as rosy for them as the last thirty were, add in climate change as well.",2020-10-22T23:06:03+00:00
Toronto,Twitter for Android,"Watching the US debate tonight. The topics include climate change, race relations, Covid 19 &amp; leadership tonight. Should be interesting &amp; informative now they have a mute mic button. #PresidentialDebate2020 #VoteBidenHarrisToSaveAmerica",2020-10-22T23:06:00+00:00
,Twitter Web App,The impact of your vote on climate change https://t.co/dYAjRq4wBv,2020-10-22T23:06:00+00:00
Los Angeles,Twitter Web App,My new working paper - Banning Coal: A Modest Proposal for U.S.-China Climate Change Cooperation. For the Penn Future of US-China Relations project. Welcome any comments! https://t.co/8v4HIWKTIj,2020-10-22T23:05:48+00:00
,Twitter Web App,"CBS News: The topics for the October 22 debate will include: COVID-19 American Families Race in America Climate Change National Security Leadership Rehashing the same topics Wallace went over? Talk about China!!, Taiwan, Hong Kong, India, South Seas takeovers!!! Real threats!!!",2020-10-22T23:05:46+00:00
She/They - Butterfly Estate,Twitter Web App,climate change and global warming. https://t.co/snTEsvwqHO,2020-10-22T23:05:42+00:00
,Twitter for iPad,Climate change? The bigger threat to America and our world is globalism and leftist plans.,2020-10-22T23:05:40+00:00
in or near the weed patch,Twitter for iPhone,@DanRather So not immediately but in a few more years under current climate change conditions ?,2020-10-22T23:05:20+00:00
NW London,Twitter Web App,"""Climate change"" Tom? Disappointed. Most sensible people have figured out that crap now. @LBC",2020-10-22T23:05:13+00:00
,Twitter for iPhone,Protected areas help waterbirds adapt to climate change https://t.co/aUAWI7LCaz,2020-10-22T23:05:12+00:00
Florida,SocialOomph,Is Climate Change Making Drought One of the Nation's Costliest Disasters? https://t.co/imjb3Lkzj9,2020-10-22T23:05:07+00:00
"Kansas City, Missouri, USA",Twitter for iPad,@JerryMander It’s bullshit. I despise climate change.,2020-10-22T23:05:03+00:00
"Oakland, CA",Twitter for iPhone,@ZizaCity Can’t wait for his “Climate. Change. Is. Real.” tweets,2020-10-22T23:04:59+00:00
"Los Angeles, CA",Twitter Web App,"This is not a healthy, standard fire season out west. I wonder if La Niña is contributing (I genuinely don't know), but the frequency, breadth, and intensity of these megafires points to shifts in large scale patterns—i.e., climate change. https://t.co/cspCZyU3qa",2020-10-22T23:04:54+00:00
,Twitter for Android,@Dabeefynacho @AustinMyhre12 @benshapiro *there are certain actions that would slow climate change that would impair your ability to contribute to society to the point of making it unhelpful to do* *voting in candidates that will help carry out climate action is a more efficient use of energy*,2020-10-22T23:04:54+00:00
"Clifton  Park, NY",Twitter for Android,"@LKrauss1 7 minutes is going to be Trump giving his normal shtick about clean water and clean air, while denying man made climate change exists.",2020-10-22T23:04:45+00:00
"Boston, MA",Twitter for iPhone,How do people not believe climate change exists in 2020,2020-10-22T23:04:37+00:00
#ᴍɪɴxᴇʀʏs,Twitter for iPhone,"“How much do you believe in the impossible?”         With a soft smile, she joined him under the rain as she changed the temperature enough for it to transform into snow. Could always blame it on climate change, right? https://t.co/G9i6LBd4tn",2020-10-22T23:04:33+00:00
,Twitter for iPhone,Trump Privately Said Climate Change May Have Made CA Wildfires Worse After Denying It on TV: NYT #SmartNews Who can keep up with this shit??? https://t.co/W1Ot63LCms,2020-10-22T23:04:27+00:00
,Twitter for iPhone,@GovRonDeSantis Just tell the dumb ass president to believe in climate change and maybe that’ll help solve our problems.,2020-10-22T23:04:25+00:00
Canada,Twitter Web App,".@UCPCaucus don't like the new Pope, cuz he's too liberal, too concerned about human rights, climate change, global poverty, disaster capitalism, indigenous rights, etc.  They pine for happier times, when you could stop gay partners from seeing each other in the hospital.  #AbLeg https://t.co/4huGzsmetD",2020-10-22T23:04:24+00:00
"San Francisco, CA",Twitter Web App,"The third and final US presidential debate will take place today from 9:00-10:30 PM ET at Belmont University in Nashville, Tennessee.  Moderator: Kirsten Welker Topics: Fighting COVID-19, American Families, Race in America, Climate Change, National Security and Leadership.",2020-10-22T23:04:24+00:00
,Twitter Web App,"@realDonaldTrump Obama was great. He called you out on a failure handling the virus, division in the country, destroying our relationships with our allies, weakening our democracy, in denial of climate change and much more.",2020-10-22T23:04:21+00:00
,Twitter Web App,"Witch Hunts, Climate, and Climate-Change Madness - https://t.co/KnT0duWRMh via @shareaholic",2020-10-22T23:04:14+00:00
,Twitter for iPad,I’m so damn sick and tired of hearing about climate change in these debates.,2020-10-22T23:04:07+00:00
Pulling Up On A Kid,Twitter for iPhone,climate change is the one issue where biden talks about jobs and opportunities instead of how shitty trump is and it’s OBVIOUS he needs to talk about that more bc it resonates with everyone,2020-10-22T23:04:04+00:00
"Massachusetts, USA",Twitter for iPhone,"@DanRather If Trump wins and climate change isn’t addressed, we might see a giraffe in the Arctic before we see a GOP health care plan.",2020-10-22T23:04:01+00:00
