user_country,source,content,date
"California, USA",Twitter for Android,"So here I sit in an Airport waiting to board a flight, assuming they would have CNN on every TV like usual so I could wash the 1st half hour of the debate before boarding; but tonight they have the Cooking Channel...🙄  Wonder why?🤔",2020-10-22T23:57:07+00:00
"London, England",Twitter Web App,When is the debate? Is it on yet? I'm watching CNN They said they'd show it Have I missed it Help me please? https://t.co/VHhSWnP34r,2020-10-22T23:57:06+00:00
,Twitter Web App,Trump Drops A Debate Day Bombshell On Himself By Admitting He Wants SCOTUS To Wipe Out Obamacare https://t.co/DOlkMOyQ3P via @politicususa,2020-10-22T23:57:06+00:00
SEATTLE WA,Twitter for Android,"Joe Biden is debating a dude with a secret Chinese bank account. Joe has already won this debate, again.",2020-10-22T23:57:06+00:00
"South Carolina, USA",Twitter for Android,"@Chris_232323 @DonaldJTrumpJr Yeah, he's taking his covid test in preparation for the debate. https://t.co/nxLitVmUwm",2020-10-22T23:57:06+00:00
Exploding Whale Memorial Park,Twitter Web App,"judge is at least calling bullshit on Zach ""I see in slow-mo and i speak only in Riot Munition"" Domka's testimony. that's cool.  Phone dead. Doddering old men gonna debate soon. time to garden, then start drinking. Solidarity with @MacSmiff who's still livetweeting this sideshow.",2020-10-22T23:57:06+00:00
"New York, USA",Twitter Web App,"First thing trump should say at the debate is: Sloe, you need to withdraw. https://t.co/iXjpTv1X2B",2020-10-22T23:57:06+00:00
"Westland, MI",Twitter for Android,Debate time! Will the mute button work? We shall see! #PresidentialDebate2020 #PresidentialDebate,2020-10-22T23:57:05+00:00
"Florida, USA",Twitter for Android,Trump Campaign Holds Press Conference Before The Debate #BidenCrimeFamiily https://t.co/sNKqNQ0Die,2020-10-22T23:57:05+00:00
"San Antonio, TX",Twitter for Android,Should I drink my way through this debate?,2020-10-22T23:57:05+00:00
She/her || 19,Twitter for iPhone,This whole debate is gonna be utter chaos,2020-10-22T23:57:05+00:00
EastFlinthills Kansas,Twitter for Android,Can you imagine the scrambling going on behind the debate scene? https://t.co/RcK4gGe8zM,2020-10-22T23:57:04+00:00
"Tucson, AZ",Twitter Web App,"@SenTedCruz Prediction: Many Americans like me will not watch this 'debate', because they don't want to see another one of Donald Trump's potential s**t-show-you want to watch it, Senator? Go right ahead-and myself and many other Americans will just vote for #JoeBidenKamalaHarris2020",2020-10-22T23:57:04+00:00
,Twitter Web App,@nypost Joe Biden let get this debate we all want u to be the president of the United States,2020-10-22T23:57:04+00:00
The court of the crimson king,Twitter Web App,taking enough muscle relaxers to miss the debate and all discussion and funny takes on the debate,2020-10-22T23:57:04+00:00
"Texas, USA",Twitter for iPhone,Debate check list:  ☑️ Ice cream ☑️ TV ☑️ Social media  ☑️ Pillow to scream into  ☑️ Antacid  ☑️ Comfort dog  ☑️ _______________ ???,2020-10-22T23:57:04+00:00
Toulon,Twitter Web App,"@urbanbarbarian Pfff ! Debate sucks . You are all already know for witch candidate you vote ... (ok i vote in France, when they are 12 to debate sooo long and they have limited time ! And second turn only 2 ... limited time. Bah boring same)  What sucks in USA Presidential , it's MONEY for win.",2020-10-22T23:57:04+00:00
,Twitter for iPhone,More Hunter Biden texts and emails emerge hours before debate https://t.co/MG6RFqZjAR via @MailOnline WTF??,2020-10-22T23:57:04+00:00
,Twitter for Android,Watching pre debate coverage. Immediately mute when Donna Brazile appears.,2020-10-22T23:57:03+00:00
,Twitter for iPad,"Hunter Biden revelations roil 2020 race hours before Trump, Biden take debate stage  https://t.co/rLkQndZ1Ra",2020-10-22T23:57:03+00:00
wisconsin,Twitter for iPad,"I wonder what the ""Over/Under"" is on how many times I say a version of the word""FUcK"" tonite during the debate??",2020-10-22T23:57:03+00:00
United States,Twitter for iPad,Great to hear @CTGreenParty candidate @justin4all2 talking up #RankedChoiceVoting in tonight’s #debates.  Check out @VoterChoiceCT &amp;  @fairvote to learn more! #ctpolitics https://t.co/SF4PcT0lCt,2020-10-22T23:57:03+00:00
,Twitter for iPhone,Wow I get to watch the disappointing and unsurprising last Thursday night episode of #bb22 and then the probably disappointing presidential debate. (Funny tho cuz muted mics)  Then will end the night amazingly by getting #SUPERBLOOM at 11pm! @Ashton5SOS here to make today better!,2020-10-22T23:57:03+00:00
Toronto,Twitter for Android,@dccc_phd @HarmitMalik I didn't even watch the debates before 2020.,2020-10-22T23:57:03+00:00
Seattle,Twitter for iPhone,Can someone explain to me why the seats are so close together at the debate??   Did they learn nothing from the first debate and the super spreaders??  #PresidentialDebate2020,2020-10-22T23:57:03+00:00
Canada,Twitter for iPhone,"Live: Trump, Biden debate in final face-off of 2020 presidential election https://t.co/LjFLkFZLut via @YouTube",2020-10-22T23:57:02+00:00
"Lynnwood, WA",Twitter for Android,"@caitoz Holy crap in 20 years we've gone from I didn't inhale to the ""lesser"" of two pedophiles? At this rate by the next presidential ""election"" the ""candidates"" will be performing human sacrifices during the debates 🤷🏽‍♂️ https://t.co/MKZv8uGkso",2020-10-22T23:57:02+00:00
"Eastern Time Zone, USA",Twitter Web App,Even Toots is gearing up for the debate.  #LiLFighter https://t.co/2aSIVHoiAM,2020-10-22T23:57:02+00:00
,Twitter Web App,"Kristen Welker, moderator, has selected the topics.  1)Fighting COVID-19 2)American Families 3)Race in America 4)Climate Change 5)National Security 6)Leadership  The debate will start at 9:00 p.m. ET and run for 90 minutes.   https://t.co/UbwZBMgxvi",2020-10-22T23:57:02+00:00
,Twitter for iPhone,If the debate goes on tonite when trump comes out and they greet each other Trump needs to say “how you doing big guy” #CorruptJoeBiden  #MAGA2020,2020-10-22T23:57:02+00:00
,Twitter for Android,"Trump thinks that not being able to interrupt in a debate is unfair but doesn't at all think it's unfair that he downplayed the Corona virus and over 220,000 people died. Trump is a delusional deplorable psychotic nasty killer criminal https://t.co/WOrOrqkUzG",2020-10-22T23:57:02+00:00
,Twitter Web App,Off to watch the Presidential debate and drink beer!  I already voted for @realDonaldTrump so nothing will change.  #PresidentialDebate2020,2020-10-22T23:57:01+00:00
"Morristown, NJ",Twitter for iPhone,@realDonaldTrump Please release more videos. Nothing could help the Biden campaign more (except maybe a debate),2020-10-22T23:57:01+00:00
,Twitter for Android,"1 hour away from the final debate. Who else is ready to see them treat President Trump unfairly, but the see Trump make them look like idiots anyway?",2020-10-22T23:57:01+00:00
Liverpool,Twitter for iPhone,"Staying up again for the last Presidential Debate, where I imagine my face is gonna look like this most of the time listening to @realDonaldTrump  😂😂😂 #presidentialdebate2020 #presidentialdebate https://t.co/YlGSwSyPjA",2020-10-22T23:57:00+00:00
"Toronto, Ontario",Twitter for iPhone,@Mister_Miracle @habte_sabroso @DarthAmin My point is what YOU “Think” doesn’t matter.  He has power and will continue to grow and dominate the league.  You can debate the extras. https://t.co/LlffMiHHDv,2020-10-22T23:56:59+00:00
A chunk of Alderaan ,Twitter for Android,Why am I about to torture myself and watch another shit show of a debate?,2020-10-22T23:56:59+00:00
"America, LooneyToons",Twitter for iPhone,Gonna watch an octopus instead of the debate.,2020-10-22T23:56:59+00:00
"Downingtown, PA",Twitter for iPhone,"Tonight, former Vice President Joe Biden will debate a crusty and decomposed jack-o’-lantern that shouts racial epithets at trick-or-treaters of color...",2020-10-22T23:56:59+00:00
SoCal,Twitter for iPhone,So Trump supposed to have a news conference before the debate tonight!,2020-10-22T23:56:59+00:00
,Twitter Web App,"BREAKING: Hunter Biden's Former Business Partner in China Scheme, Tony Bobulinski, Who Just Flipped -- Will Be Trump's Special Guest at Final Debate via @gatewaypundit https://t.co/qJPMSffoy2",2020-10-22T23:56:59+00:00
"if u a tsukki lover, dm me",Twitter Web App,THE DEBATE I TOTALLY FORGOT AB TIT,2020-10-22T23:56:58+00:00
Lost in Space ,Twitter for iPhone,From the laptop from hell to the debate from _________?  Holy 💩,2020-10-22T23:56:58+00:00
"Redmond, WA",Twitter Web App,Trump expected to bring Hunter Biden's former business partner to debate https://t.co/AXt2XxNyPG,2020-10-22T23:56:58+00:00
"New York, NY",Twitter for iPhone,we rly have to suffer thru another debate tonight https://t.co/uD8hHPLMJh,2020-10-22T23:56:58+00:00
"Chicago, IL",Twitter Web App,"talking ""the problem of voting,"" doing a point-by-point refutation of the contrapoints video, if ppl show out i'll also livestream the debate @ 8pm CT, say ""hi"" in chat :)  https://t.co/whvQWTMzV1",2020-10-22T23:56:58+00:00
Tampa,Twitter for iPhone,Best sports show on tv. No hot takes. Just good sports debate. https://t.co/XeyDYO008m,2020-10-22T23:56:58+00:00
"New Haven, CT",Twitter for Android,DeLauro opposes term limits... shocking! #CT03 #Debate #Nhvpoli https://t.co/RbPCYOjEEj,2020-10-22T23:56:57+00:00
,Twitter for iPhone,I want and need wine for this debate but my wine opener is in the basement and it seems like so much work to go get it.,2020-10-22T23:56:56+00:00
,Twitter for iPhone,Biden will call a lid before the debate  #BidenCrimeFamilyExposed https://t.co/eg8Sqqgkk9,2020-10-22T23:56:56+00:00
"New York, NY",Twitter Web App,@transb0rder Me too 😖 and I have to work tonight and that's the only reason I remembered we had a debate help me,2020-10-22T23:56:56+00:00
,Twitter for iPhone,Wonder if he showing up to the debate??? https://t.co/0ms9ElIJJl,2020-10-22T23:56:56+00:00
"Columbus, OH",Twitter for iPhone,Wait Eagles vs Giants?!?!🤮🤮 bruh I’d rather watch the debate. I’m good on that dumpster fire,2020-10-22T23:56:56+00:00
"Hampstead, MD",Twitter for iPhone,Bigger shit show - Giants/Eagles or the debate???,2020-10-22T23:56:55+00:00
United States,Instagram,Excited to the presidential debate. https://t.co/VSjnhazlFZ,2020-10-22T23:56:55+00:00
,Twitter for iPhone,Banger stream tonight we gonna have a live nfl reaction party/debate then the bawskee 4 album reaction,2020-10-22T23:56:55+00:00
Los Angeles,Twitter for iPhone,I can’t wait to not watch the debate tonight. #Debates2020,2020-10-22T23:56:54+00:00
"Philadelphia, PA",Twitter for Android,"Planted in front of my TV, waiting for @MSNBC 's debate coverage to begin.",2020-10-22T23:56:54+00:00
bi she/her minor | blm,Twitter for iPhone,wait isnt there a debate tn 😭,2020-10-22T23:56:54+00:00
Ireland,Twitter for Android,@Geddy7777 Hehe I'm waiting on the final debate 🤦🏻‍♀️ #Debates2020,2020-10-22T23:56:54+00:00
,TweetDeck,FINAL TRUMP-BIDEN DEBATE WATCH PARTY  Join @BenSwann_ and his guests:  @TimRunsHisMouth  Twitch streamer Destiny (https://t.co/RNpN0odc8M) @LeeCamp @Barnes_Law @LaDawnLBJJones Lance from @theserfstv @MikeWeaponized  NO BULLS**T  TUNE IN NOW!  https://t.co/aIo0Ql3mlJ https://t.co/Ninhfw5rWS,2020-10-22T23:56:54+00:00
"Cleveland, OK",Twitter for iPhone,@kiddwikked @HEELZiggler I know you didn’t read that all. I can’t wait for the Debate tonight.,2020-10-22T23:56:54+00:00
"Portland, ME",Twitter for iPhone,The (male) independent candidate in the #Maine #senate election debate just referred to #SusanCollins and #SaraGideon as a “catfight”. What a sexist comment.,2020-10-22T23:56:53+00:00
West Coast R&D ,Twitter for iPhone,Waiting on tonight’s debate https://t.co/2eEsqlg9yv,2020-10-22T23:56:53+00:00
,Twitter for Android,No other Network carried the #TonyBobulinski presser! #Trump2020 #FourMoreYears #LatinosForTrump #WomenForTrump #Debate,2020-10-22T23:56:53+00:00
,LinkedIn,"Presidential Debate Commission should eject Trump if he attempts to pull any stunts to turn the debate into a Jerry Springer clown hour, in order to distract the masses that Trump has zero policies to discuss and Trump wants to avo…https://t.co/tcBavcJ2IX https://t.co/10W6D1EgJU",2020-10-22T23:56:53+00:00
,Twitter for iPhone,Who thought it was a good idea to have another debate?,2020-10-22T23:56:53+00:00
"Sacramento, CA",Twitter Web App,T-minus 1 hour until the clown show starts!! 🤡   #Debates2020 #Debates #ClownShow #TFTP https://t.co/eqpNpxDmLE,2020-10-22T23:56:53+00:00
,Twitter for iPhone,Has Biden put a lid on his campaign for the next 12 days? How long after the debate does his handlers do it? #BidenCrimeFamily #BidenHarris2020 #ChinaBiden,2020-10-22T23:56:53+00:00
,Twitter for iPhone,Donald is going to dispel stroke rumours by leading the conga line on to the debate stage. The Loud &amp; Proud 🌈 Boys will follow dancing to Macho Man. Loud &amp; Proud 🌈 Boy presented Donal with a pair of black leather chaps. It is still unconfirmed if he will be wearing them tonight https://t.co/SMbuwtChHx,2020-10-22T23:56:53+00:00
AMERICA,Twitter Web App,"This is not a debate, It is a question and answer session. A debate is where thet debate each other stand, what this is , is BULLShIT!💩 https://t.co/5yjUHCkIYf",2020-10-22T23:56:53+00:00
,Twitter for iPhone,"@jebus911 here you go, thats all you need for a successful debate ;) https://t.co/ma1SI3g8Fz",2020-10-22T23:56:52+00:00
,Twitter for iPhone,Did y’all bring up debate and Lincoln Douglas to them. I never went and won a varsity match and a mock match against someone good.,2020-10-22T23:56:52+00:00
"Washington, DC and Joplin, Mo.",Twitter for iPhone,This #MESen debate is the most decaffeinated debate I’ve seen so far this year (even more than the #MTSen Steves).   The palate-cleansing ginger before tonight’s Trump-Biden sushi.,2020-10-22T23:56:52+00:00
"South Dublin, Ireland",Twitter for iPhone,@PMcCrum You watching the debate this evening Paul... #election2020 🇺🇸,2020-10-22T23:56:52+00:00
United States,Twitter for iPhone,"@drawandstrike The cherry on top, would be Biden being arrested tonight at the debate!!  #wishfulthinking",2020-10-22T23:56:51+00:00
"Philadelphia, PA",Twitter for iPhone,"So far, been the easiest round yet. Pounding bubbly water with a little bit of lemon tonight during the debate is gonna be a slight change from the last one tho",2020-10-22T23:56:51+00:00
"East Coast Pandemia, USA",Twitter Web App,@JasonMillerinDC Hi Jason! Just a quick note to let you know that twitter is going CRAZY tonight comparing Trump's debate style with a monkey throwing it's own poop! Enjoy! #TrumpIsPathetic https://t.co/GAyhZFecG5,2020-10-22T23:56:51+00:00
,Twitter Web App,Trump invites Hunter Biden ex-associate Tony Bobulinski to final debate https://t.co/YT0BXLKJ8Z via @YouTube,2020-10-22T23:56:50+00:00
Tennessee,Twitter Web App,I can't wait to watch the debates!,2020-10-22T23:56:50+00:00
Canada,Twitter Web App,#Debates2020  So is Trump going to show up on time for a pre debate Covid test this time?,2020-10-22T23:56:50+00:00
Sunny California,Twitter for iPhone,My ballot is already in so there’s no way in hell I’m subjecting myself to the debate tonight.,2020-10-22T23:56:50+00:00
NC ➡️ GA ➡️ CT,Twitter Web App,My state rep @lucydathan is absolutely KILLING IT in this debate!! Starting the hashtag #ilovelucy to support Lucy's campaign!,2020-10-22T23:56:50+00:00
minor !!,Twitter for iPhone,donald trump is a fucking idiot vote him out #PresidentialDebate2020 #TrumpMeltdown #TrumpIsPathetic #debates  https://t.co/QUg72ytYEc,2020-10-22T23:56:50+00:00
,Twitter Web App,@JoeBiden Which one closer reflects your actual thoughts:  This Tweet or your prepared responses at the debate?,2020-10-22T23:56:50+00:00
,Twitter for iPhone,Forget the popcorn 🍿 I need wine for tonight’s debate!! https://t.co/6YrCMJ2cci,2020-10-22T23:56:49+00:00
,Twitter Web App,@ByronYork MAYBE THE PROBLEM WAS THE BIASED QUESTIONS SHE WAS ASKING . SEEMS ALL THESE SO CALLED JOURNALIST WANT TO DO IS DEBATE TRUMP AND PENCE.,2020-10-22T23:56:49+00:00
,Twitter for iPhone,"Funny how Democrats only want to talk about Covid, which conveniently originated in China, when the last debate traditionally addresses foreign policy and the economy.  Any ideas why🙄🙄",2020-10-22T23:56:49+00:00
,Twitter for iPad,@chipfranklin US presidential debates are hyped like an upcoming WWE cage match.,2020-10-22T23:56:49+00:00
"Nashville, TN",Twitter for iPhone,"It’s already been an insane day, and now there’s a debate. #Debates2020",2020-10-22T23:56:49+00:00
,Twitter for iPhone,@realDonaldTrump Starting the blame game for losing the debate...,2020-10-22T23:56:49+00:00
,Twitter for Android,@JoeBiden It's sad and pathetic that guys won't let 3rd party candidates like @HowieHawkins @Jorgensen4POTUS @dario4america on stage to participate in the debate but I guess that's what you get when both the @DNC and @GOP are one in the same tonight is not a real #debate #Debates2020,2020-10-22T23:56:48+00:00
"Fairmont, WV",Twitter for iPhone,"I’m gonna flip from the Eagles game to the debate when I get mad about football, and flip from the debate to the game when I get mad about the future of our country till I end up breaking my thumb from spamming the recall button.",2020-10-22T23:56:48+00:00
"New York, USA",Twitter for iPhone,"Biden camp using bias debate moderator Chris Wallace as a shield. I didn’t know Wallace was their official surrogate, except for his flagrant bias at the debate... https://t.co/8Q7WgjMN3I",2020-10-22T23:56:48+00:00
,Twitter for iPhone,"Every single time there's a Presidential Debate it's nothing but people saying, ""this is an embarrassment"", ""this is awful"", and gassing up the candidate they were already going to vote for anyway lmfao.",2020-10-22T23:56:48+00:00
,Twitter Web App,"@real_defender Tonight's debate will be another demonstration of Donald Trump's incredibly poor conduct whenever asked questions about how badly he's fucked up as the nation's President.  Any ""poor"" treatment he gets, he's brought upon himself, and those who chose to follow are backing a loser.",2020-10-22T23:56:48+00:00
"Los Angeles, CA",Twitter for iPhone,"@JoeBiden You know a president is desperate when his debate preparation is to bring up China, and hunter Biden.. that’s a sad desperate man who know he’s going to lose...",2020-10-22T23:56:47+00:00
,Twitter Web App,"@bourgeoisalien Prediction: Being on verge of full mental degeneration, and after seeing what Borat did to buddy Giuliani, Trump comes out and begins masturbating, behind his podium, finishing and flinging his junk at debate moderator, full ""Silence of the Lambs"" style. #Debates2020",2020-10-22T23:56:46+00:00
"California, USA",Twitter for iPhone,Anyone know where I can stream the debate? I don’t have cable,2020-10-22T23:56:46+00:00
"Hawkins, IN",Twitter for Android,I'll be spending this presidential debate thinking about how Steve loves to eat Billy's ass and that's that on that,2020-10-22T23:56:46+00:00
,Twitter for iPad,@MysterySolvent 6 of 1. It’s a long debate.,2020-10-22T23:56:46+00:00
"Ashland, OR",Twitter for iPhone,This should summarize tonight’s debate in a nutshell: https://t.co/K7PdIHS4R3,2020-10-22T23:56:46+00:00
Australia,Echobox,It's High Noon (AEDT) for Donald Trump and Joe Biden. Our live blog on the make-or-break final presidential debate is up and running with @jacobgreber @mrjoeaston and @rohansullivan https://t.co/qH7izNZW2B,2020-10-22T23:56:46+00:00
"Portland, Oregon",Twitter Web App,"Cop union defends indefensible cop, another (ugh!) unnecessary debate, and... seriously, our crybaby president can't even drink a stupid glass of water? It's GOOD AFTERNOON, NEWS! https://t.co/fVx1kJTatp",2020-10-22T23:56:46+00:00
,Twitter for iPhone,@CheeseheadIndy Honestly the debate to see what kind of a shit show it is,2020-10-22T23:56:46+00:00
IG: aye_callmeangie,Twitter for iPhone,I totally forgot today was the presidential debate and I made plans. ☹️,2020-10-22T23:56:45+00:00
"Cleveland, OH",Twitter for iPhone,Well I can see it’s about that time to log off Twitter for the night. Enjoy the debates all. Politics is not my thing ✌️.,2020-10-22T23:56:45+00:00
stay multi,Twitter for iPhone,do i watch the debate or do i retain my brain cells,2020-10-22T23:56:45+00:00
"St. Paul, Minnesota",Twitter Web App,"Pretty sure this debate would kill anyone who did a drinking game, unless the drink was if Trump says ""great question"" or Biden said, ""great point, Mr. President.""  #MSNBC #PresidentialDebate2020",2020-10-22T23:56:45+00:00
,Twitter Web App,I don't think a single one of us could predict what will come from tonight's debate. Shit show comes to mind. Intense interference and mic abuse to try and frustrate POTUS. Don't see any relevance in the Bobulinski appearance...it's a closed debate...what's the purpose?,2020-10-22T23:56:45+00:00
"San Francisco, CA",Twitter for iPhone,Idk if I can watch the debate. So here’s my dinner. #SantaBarbara https://t.co/NhfLQ2guR8,2020-10-22T23:56:45+00:00
San Diego,Twitter Web App,"I fear this also, but was encouraged by the measured and real responses from VP Biden in debate 1 that showed how hollow any trump yelling was. Hoping for something similar...just getting through it with some idea things can be better. https://t.co/SRh2Tmz4tv",2020-10-22T23:56:45+00:00
Hell,Twitter for iPhone,I want to sleep so bad fuck this debate,2020-10-22T23:56:45+00:00
Wherever I lay my hat,Twitter Web App,😂🤣BOOM🤣😂 Scroll to 12 mins for the start.  Trumps special guest in the audience at the debate tonight too. 👏👏👏👏  https://t.co/yFhYFTzcZK,2020-10-22T23:56:44+00:00
,Twitter Web App,Link for the live debate on FOX  https://t.co/ok5thELEfV,2020-10-22T23:56:44+00:00
"Collingswood, NJ",Twitter for iPhone,Hmmm... what tragedy should I watch tonight... the Eagles game or the presidential debate...,2020-10-22T23:56:43+00:00
LA 📍,Twitter for iPhone,This debate is finna be jokes asf,2020-10-22T23:56:43+00:00
Los Angeles,Twitter for iPhone,The weather is getting chillier and the stakes are getting higher in tonight’s debate. Vote. #teachertwitter #TeacherLife https://t.co/2dBBDmkpSy,2020-10-22T23:56:43+00:00
Australia,Twitter Web App,@aus_spirit What time is the debate and where can we watch?,2020-10-22T23:56:43+00:00
no,Twitter Web App,"more re2 with @GenGoodsman tonight, ft the debate! come hang out and see what a much better channel than mine looks like https://t.co/9pGDa220pg",2020-10-22T23:56:42+00:00
,Twitter Web App,I will use picture in picture to watch the debate and the game. Then I will be able to watch Trump  lose his temper and hopefully not see my Eagles lose the game.,2020-10-22T23:56:42+00:00
"Cleveland, OH",Twitter for iPhone,"Trump MUST think since the Stormy Daniels wasn’t damaging, he might as well go to the mattresses with this Hunter Biden crap. You are the president of the US and a #POS! US Election 2020: Hunter Biden emails emerge hours before debate | Daily Mail Online https://t.co/niT1D1zh1T",2020-10-22T23:56:42+00:00
"Tipp City, Ohio",Twitter for Android,Are you ready for the debate? I am! #Debatenight https://t.co/iOsGcgHDEn,2020-10-22T23:56:42+00:00
Louisiana ,Twitter for Android,#PresidentialDebate2020 #PresidentialDebate #Debate2020 #debates   I WILL!! https://t.co/beSQywa0Cm,2020-10-22T23:56:42+00:00
"Madison County, Illinois",Twitter Web App,"@CNN I love watching CNN and your pre and post debate conversations, but I won't be watching because of that creepy Rick Santorum, I know you try to have a balanced group of commentators but he is completely incompetant and not a good addition to your staff, watching MSNBC",2020-10-22T23:56:42+00:00
19!!! | she/her,Twitter for Android,"im not gonna be watching the debate tonight. i probably will tomorrow, theres a lot going on tonight and i need a little breather ❤",2020-10-22T23:56:42+00:00
"California, USA",Twitter for Android,She won't!  Pressure builds for NBC's Kristen Welker to address Hunter Biden at debate: ‘This is a moment of truth'  https://t.co/n6ISMilnz5,2020-10-22T23:56:41+00:00
,Twitter for iPhone,"I feel like we missed the boat...do you know how many people would have paid BIG money to be in control of the mute button for tonight’s debate?! Money could have well-served food banks, animal shelters, or schools. https://t.co/NOPThWhzLX",2020-10-22T23:56:41+00:00
"Philadelphia, PA",Twitter Web App,Joe Biden getting ready for Trump's lies at the debate tonight like...  (GIPHY link: https://t.co/7uqSeZjw8B) https://t.co/lTjFuNlBuK,2020-10-22T23:56:41+00:00
,Twitter Web App,@Schouten_B @HalJord43531085 @RealJamesWoods Just watched the Babulinski presser.  Seems like an earnest businessman pissed that he's involved.  But if he goes to the debate as DJT's troll (classic Trump)... then I'm back to TBD. Doesn't jibe with someone who wants off the radar.,2020-10-22T23:56:40+00:00
,Twitter for iPhone,"@newscentermaine glad to see  all of @PatCallaghan6 requests be approved tonight.  Overall a productive debate.  Thank you to all involved, particularly Pat with an excellent job moderating tonight.",2020-10-22T23:56:40+00:00
,Twitter for iPhone,Ppl gonna really watch the #debate when #collegefootball and #nfl is on? Smfh,2020-10-22T23:56:40+00:00
"Cedar Park, TX",Twitter Web App,@CJPrice20 Do you need our debate bingo card?,2020-10-22T23:56:40+00:00
California ,Twitter for iPhone,Excited for @bryceingalls22 live tweeting during the debate. Cant wait #Debates2020,2020-10-22T23:56:39+00:00
