user_country,source,content,date
,Twitter Web App,"@ClimateSkeptic4 @WeiZhangAtmos 6/n that there are many links between the organizations that tried to muddle the science on tobacco and those that do the same with climate change? Read the book ""Merchants of Doubt."" Same with pesticides, acid rain, second-hand smoke, and the O-zone. The scientists were ALWAYS",2020-10-22T22:28:09+00:00
"Brisbane, Queensland",Twitter Web App,From climate change denier as part of a government which lives in a coal mine this...  Mathias Cormann talks up green recovery as part of his pitch to lead OECD https://t.co/FJpiLvW67f,2020-10-22T22:28:03+00:00
"St Louis, MO",Twitter Web App,"Can't wait to get my copy of the new book by @LynneQuarmby! I may be slightly biased (🙃), but I think she rocks!! She has a way of talking about science that just draws you in... and I'm excited to get her views on climate change.   More info: https://t.co/MVRcjc9vyl https://t.co/GWOeWl3CP7",2020-10-22T22:27:58+00:00
"Columbus, Ohio",Twitter for iPhone,@newdeal4us The time is now to address climate change,2020-10-22T22:27:56+00:00
"State College, PA",Twitter for Android,I talked on @WeatherWorldPSU this evening about how climate change is impacting forests in Pennsylvania and what this will mean for fall foliage in the future. @ClimateCentral @psumeteo  Link: https://t.co/ZfEzU5CerY https://t.co/BsGNURHCTX,2020-10-22T22:27:49+00:00
"Washington, DC ",Twitter Web App,"This series shows how @LPE_Project frameworks can help us examine law’s role in the perpetuation of racial and gender injustice, the devaluation of social and ecological reproduction, and the violence of the carceral state under capitalism. Today, we are looking at climate change https://t.co/jrb7Z9hTHC https://t.co/ZxJynk1ZK3",2020-10-22T22:27:48+00:00
"Portland, OR",Twitter Web App,"The state Supreme Court turned away plaintiffs' bid to force Oregon into doing more to protect against climate change damage, @petedanko reports. https://t.co/VQU4rcnfcV #orpol #orleg",2020-10-22T22:27:48+00:00
,Twitter Web App,Trump privately conceded '50-50' climate change role in California wildfires https://t.co/DrVg6NUtq0,2020-10-22T22:27:45+00:00
"Oakland, CA",Twitter Web App,"The best way to get manufacturing back is to spend so many dollars the world doesn't want them anymore. At least $20T over a decade: infrastructure, education, health care, affordable housing, and climate change.   What did China do anyway? Just look at their debt:GDP. https://t.co/o78TUQPqIU",2020-10-22T22:27:36+00:00
,Twitter for iPhone,@TaylorLarson2 @Aminastotle The Republican Party is actively fighting all three.  1) taking the ACA to the Supreme Court to strike it down. 2) Blocking raise the wage act 3) Denying 99% of the world’s scientists on climate change . Those 3 actions would empower people of color &amp; Rep. party is fighting it.,2020-10-22T22:27:28+00:00
"Palo Alto, CA",Twitter for iPhone,Americans are evolving on climate change and should stop electing representatives that won’t. https://t.co/bL8chHKOj3,2020-10-22T22:27:16+00:00
"Colorado, USA",Twitter Web App,"@dhershiser Curious what you think voting blue will accomplish?  What platform are the @DNC running on that will have real substantive change in regards to climate change?  I would love to see policy, or legislation, all I have seen is Joe saying he won't ban fracking and befriending the GOP",2020-10-22T22:27:10+00:00
,Twitter for iPhone,"@sonyasavage For the love of god, and for the sake of your ESG messaging, add something to these tweets about ‘the importance of dramatic emission intensity improvements to ensure climate change is mitigated if these projections are accurate.’ Otherwise you look so out of touch!",2020-10-22T22:27:10+00:00
"Colorado, USA",Twitter for Android,@TheCharlier You know what's also tragic? The fact that the so called environmentalists made regulations that didn't allow our forests to be logged and mitigated and now we are blaming their negligence on climate change. Climates been changing since the Earths creation FYI.,2020-10-22T22:27:07+00:00
"Florida, USA",Twitter for Android,"@InfoHippo @zoom_zoomer @scrowder Because I dont deny climate change...? What? Dude, are you so deep in the bandwagon that you think everyone just fits in your cookie cutter stereotypes? Strawman me all you want. I follow the IPCC. You clearly do not.",2020-10-22T22:27:00+00:00
,Twitter for iPhone,"universal healthcare, free college, debt forgiveness, the abolishment of the electoral college, a government that cares about climate change and equal pay for women https://t.co/Pf8AMEtc4J",2020-10-22T22:26:57+00:00
Canada,Twitter for iPad,Climate change needs to be addressed!🇺🇸🇺🇸🇺🇸🇺🇸🇺🇸🇺🇸😢😢😢😢😢😢👎🏼👎🏼👎🏼👎🏼👎🏼👎🏼 https://t.co/i9UUF8tXeN,2020-10-22T22:26:43+00:00
Always with ma mama snoring ,TwinyBots,How Innovative AI Solutions Can Help Combat Global Warming #ClimateChange via https://t.co/ZaLHOJyHRF https://t.co/BKwMgo1wkb,2020-10-22T22:26:40+00:00
Earth,Twitter for iPhone,"Amazon: We care about the environment!  Also Amazon: Gives $$ to candidates who call climate change a ""hoax"" #ClimateCrisis #BreakUpAmazon  https://t.co/koHknGO8tO",2020-10-22T22:26:37+00:00
Parts Unknown,Twitter for Android,"@ibookery @815wrldtrvlr @drkiki Must be because of climate change, right??",2020-10-22T22:26:35+00:00
,Twitter for Android,The Greens keep asking for donations.  What for.  They can't  do a thing.  They have not the numbers in any parliament . The LNP are off the planet and the Greens railroad Labor when they attempt  to implement  change  to get a better climate outcome. Hopeless,2020-10-22T22:26:35+00:00
,Twitter for Android,@realDonaldTrump Here's how to change climate change into foreign policy ask Biden how he is going to get China to reduce their emmisions of greenhouse gases,2020-10-22T22:26:21+00:00
"Chicago, IL",Twitter for iPhone,"@LI2Miami No time, may have &lt;2 yrs to get critical legislation (voting rights, judicial reform, climate change, public option, anti corruption...) thru before Senate flips again.  Follow GOP lead, set the SCOTUS table, then start pushing reforms thru. Should’ve learned this lesson in 2008.",2020-10-22T22:26:10+00:00
"Melbourne, AU",Twitter for Mac,"The majority vote in Australia prefers self entitlement over #ClimateChange.  That vote has consistently found exactly the politicians it needs to do nothing.  2013. 2016, 2019.  The MORRISON FIRES were one consequence and we’re now heading to 4℃+ warming https://t.co/8AeDVeUQ7b",2020-10-22T22:26:08+00:00
"Federal Way, WA",Twitter for iPhone,"@Stonekettle We want affordable health care, we want our govt to listen to the scientists regarding the pandemic and climate change and we never want to hear the name trump again unless it’s followed by the word guilty and the rap of a gavel",2020-10-22T22:26:05+00:00
Westchester ny,Twitter for iPhone,@SethMacFarlane And you believe the bullshit. Everyone is so worried about climate change. But Americans emissions have dropped 3% how about all you green birds go and boycott China 🇨🇳. Oh that’s right you don’t care the way China 🇨🇳 doesn’t,2020-10-22T22:25:59+00:00
,Twitter for iPad,@nathancole @TerminalKaral @spaceXcentric @realDonaldTrump @scrowder @hodgetwins @benshapiro @DonaldJTrumpJr @DanCrenshawTX @Jim_Jordan @tedcruz @dbongino @RichardGrenell @glennbeck @charliekirk11 @kayleighmcenany @DLoesch @DineshDSouza @greggutfeld ...as opposed to being spoon fed science denial propaganda as presented by the fossil fuel industry? #ClimateChange #ClimateCrisis #climatebrawl #ClimateEmergency,2020-10-22T22:25:56+00:00
"Sacramento, CA",Twitter Web App,This is really effective science communication and comes with policy recommendations and opportunities for California to focus on nature-based solutions to combat climate change. Thank you @Conserve_CA  https://t.co/NKcglCGmhM,2020-10-22T22:25:49+00:00
"Beverley, Western Australia",Twitter for iPhone,This was 2016 wet As Fuk  Crops were gunna be thumpers  Then a huge frost event  We had to do this more than once that year  Is this climate change ? Nah just a wet as year  2010 dry as 2020 same  Next year ???? Year after ???? And so on  Seen it before  Have fun  RUOK????? https://t.co/3SIMac4xbE,2020-10-22T22:25:42+00:00
bed,Twitter Web App,thinking about how my mother said we'll just adapt to climate change because of evolution,2020-10-22T22:25:29+00:00
"Centerville, Ohio",Twitter Web App,"@newdeal4us Great discussion on zoom, Facebook and you need to hear it. #ReImagineAppalachia #ClimateChange Get the jobs out there to make a difference.",2020-10-22T22:25:10+00:00
"Austin, TX",Twitter Web App,"@ZenAndHopscotch @snarkgrapefruit Also, the argument that  ""My family has""  - believed the earth is flat - believed there is not climate change - believed we don't need to vaccinate - believed gays are bad - believed blacks are 3/5 of a person  ""for generations"" is *LITERALLY* the definition of conservatism.",2020-10-22T22:25:04+00:00
,Hootsuite Inc.,Read about the state of Hawaii’s climate in 2020. Read the latest edition of He Lono Moku highlighting progress and celebrating the change-makers working to protect Hawaii’s environment https://t.co/N5JTnOyXP8 https://t.co/ifK1alOaws,2020-10-22T22:25:03+00:00
,Sprout Social,James Pizaro &amp; Emily Schalkham are passionate about #ClimateChange. They’ve assisted in passing legislation and helped @TownofIslip become a Climate Smart Community. They're leaders in the fight against #GlobalWarming &amp; I'm proud to call them Seawolves. https://t.co/kVz2my2gzD,2020-10-22T22:25:01+00:00
"Westminster, London","Cheap Bots, Done Quick!",I'm very clear that dope Spotify playlists are important to climate change talks,2020-10-22T22:25:01+00:00
,Twitter for iPhone,Tonight is the final presidential debate for the 2020 election. Make sure to check it out at 8:00! Here are some topics that will be discussed: ▪fighting COVID-19 ▪American families ▪race in America ▪climate change ▪national security ▪leadership https://t.co/jZasMxvIDC,2020-10-22T22:24:49+00:00
,Twitter for iPhone,@JoeBiden You’re still fighting climate change reform. You don’t want to ban fracking. You denied the green new deal which is necessary at this point. The world is on fire and you don’t care.,2020-10-22T22:24:44+00:00
,Twitter for iPhone,"@TaylorLarson2 @Aminastotle Look, there are certain policies we are advocating for such as universal healthcare, a livable wage, and climate change that would deeply impact communities living on the margin. Those communities are people of color and folks who are suffering from poverty.",2020-10-22T22:24:35+00:00
United States,TwinyBots,How Innovative AI Solutions Can Help Combat Global Warming #ClimateChange via https://t.co/lsjPxljA2P https://t.co/4tbTQt2key,2020-10-22T22:24:25+00:00
,Twitter Web App,"Harris: We can expect women and children in the Global South to suffer most from the ""wicked problem"" of climate change. An LPE analysis shows how climate change is inseparable from hierarchies of gender and race. #LPE101",2020-10-22T22:24:14+00:00
,Twitter Web App,"@AdamskiPeter @GeraldKutney @CSPGeologists In fact, the greater human influence on #climatechange, as acknowledged by Houghton 1996 definition himself  is land use, water diversion, agriculture, Urban Heat Island - so the UNFCCC def is scientifically incorrect as well as full of subjective assumptions. #climatechange",2020-10-22T22:24:13+00:00
"Melbourne, Australia",Twitter for iPhone,"@MathiasCormann should be let no where near the OECD - after his long participation in a Govt that has done everything in their power to deny, obfuscate and block recognition of the impacts of climate change - incl bringing a lump of coal into parliament &amp; touting its virtues. https://t.co/tqaTCugT4l",2020-10-22T22:24:03+00:00
"Massachusetts, USA",Twitter Web App,"@JonDArsen @SteveDucey @WajahatAli ""These solutions are almost always incremental and market-based, and these same Democrats refuse to embrace what’s actually needed: keep fossil fuels in the ground, and mobilize public resources so that we can make the broad social changes we need to address the climate crisis.""",2020-10-22T22:23:59+00:00
"Missouri, USA",Twitter for iPhone,For ⁦@westvikings⁩ ⁦@CPSScience⁩ ⁦@COMOSustain⁩ The intersection of my two biggest human concerns: climate/environment “change” and racial injustice. How they are more aligned than many know. Great listen! https://t.co/VbGGPxXXgn,2020-10-22T22:23:56+00:00
"British Columbia, Canada",Twitter for iPhone,"Under Biden, The country will be better off economically, and will start to get back to normal with less violence, a pandemic plan in place, more jobs will be created, climate change will be a priority. Biden promises NOT to increase taxes if you earn less than $400,000. Facts https://t.co/SZcQ24op9T",2020-10-22T22:23:50+00:00
"Capitol Hill, Washington",Twitter Web App,Learning about generational perspectives on climate crisis at the @ClimateCenterWV webinar with Dr. @Fisher_DanaR and Dr. @DanielleFLawson #youthclimatemovement #climateactivism #climategenerations #climatemovement #climatechange #FridaysForFuture #zerohour #thisiszerohour https://t.co/ykInwvjTQJ,2020-10-22T22:23:45+00:00
sc; rodriguezzxoxo,Twitter for iPhone,"@anuu0_0 I know a lot of it ya but even politics, climate change, and soooooo many other things on top of that",2020-10-22T22:23:44+00:00
,Twitter Web App,".@RobertKennedyJr yesterday U retweeted a Climate Change thread which basically said .@realDonaldTrump is a bad guy &amp; has done nothing but hurt the world.  I will say it again Mr Kennedy I admire much of your work, but when U send messages condemning Mr P don't LIE. Read the GOOD https://t.co/ZjuCYEzXtD",2020-10-22T22:23:38+00:00
INTERGALACTIC CITIZEN,Twitter for iPhone,"@washingtonpost Climate is changing, and has never stopped changing for 5,000,000,000 years.   Humans have not ever controlled it, and will not ever control it.   Climate change zealots are no more science-grounded than people who threw virgins into volcanoes.",2020-10-22T22:23:31+00:00
Embrace your weird,Twitter for iPhone,"2020 could be best summed up in a video that would contain the audio of B*n Shap*ro reading the lyrics to WAP over b roll that’s a collage of political discourse (news clips/debate clips), a covid spread graph, and climate change clips.",2020-10-22T22:23:24+00:00
she|her • 19,Twitter for iPhone,I hated how in hs my teachers used to have us do these weekly debates where we would be forced to split into sides and fight over sensitive topics like abortion/capital punishment/climate change and it would literally determine who would hate you for the rest of your hs days,2020-10-22T22:23:23+00:00
"Lincoln, NE",Twitter Web App,"""How climate change is affecting roadkill""",2020-10-22T22:23:21+00:00
Murdochistan,Twitter for iPhone,@hughriminton We’ve exceeded the planet’s life supporting biosphere &amp; climate limits in every conceivable way. Not that I’d expect any blue tick journalist to know or care.   (7 billion is definitely only a short term limit without climate change impacts.)  https://t.co/RuUFhObvtV,2020-10-22T22:23:21+00:00
,Twitter for iPad,@TerminalKaral @nathancole @spaceXcentric @realDonaldTrump @scrowder @hodgetwins @benshapiro @DonaldJTrumpJr @DanCrenshawTX @Jim_Jordan @tedcruz @dbongino @RichardGrenell @glennbeck @charliekirk11 @kayleighmcenany @DLoesch @DineshDSouza @greggutfeld So you still haven’t found one major scientific institute anywhere in the world to support your ideas? Maybe you need to learn more about the subject  #ClimateChange #ClimateEmergency #climatebrawl #ClimateCrisis,2020-10-22T22:23:16+00:00
"Encino, CA",Twitter Web App,"Wipe out healthcare, women's access to care, LGBTQ equality, voters' right, &amp; do more to speed up climate change.  Sounds like a great choice. Democrats &amp; the majority of Americans are powerless to stop this. https://t.co/qlBXn1Ono5",2020-10-22T22:23:15+00:00
United Kingdom,Twitter for iPhone,That David Attenborough documentary about climate change really scared me so I’m thinking I don’t really need that cute embroidered cardigan anymore tbh?,2020-10-22T22:23:15+00:00
"Chicago, IL",WordPress.com,Heat-Bouncing Paint Is Latest Weapon Against Climate Change https://t.co/T3QghXGjWS,2020-10-22T22:23:13+00:00
"Sea, Sky & Stars",Twitter for iPhone,"@LionelMedia the biggest 🦠the Earth has known: the globalist criminal network suffocating life and breath out of every living creature with heart and spirit, all while lying to the world they will save it from “climate change”, with only intent to kill billions and usher 💵new shill💩",2020-10-22T22:23:11+00:00
,Twitter for Android,"@CDU_CSU_EP for a future of our nature, #ListentotheScientists, be brave for the defeat  #ClimateChange https://t.co/azOwLGC7S4",2020-10-22T22:23:06+00:00
NYC,Twitter for iPhone,Imagine if I could insist my tax monies went towards slowing down climate change... #scichat https://t.co/lyATAsEVYD,2020-10-22T22:23:04+00:00
Nevada,Buffer,"Need a cheat sheet for #2020Election? After careful vetting, @NVConservation believes these candidates are the environmental champions that will help NV lead in #RenewableEnergy, #CleanEnergyEconomy &amp; addressing #ClimateChange. #DecisionMakersMatter➡https://t.co/zKNQtSqQfX https://t.co/afknuStD4W",2020-10-22T22:23:04+00:00
CA-11,Twitter Web App,"Tonight I’ll be watching @JoeBiden talk about his plans to beat this pandemic &amp; restore our economy, tackle climate change, and work toward racial justice at the #Debate2020. Tune in and then make a plan to #vote at https://t.co/BlRqxb8oxV!",2020-10-22T22:22:55+00:00
NY/Abuja,Twitter for Android,Let me focus some more on #Election2020   The #Debates2020 will covers:  📌 Covid-19 📌 American families 📌 Race in America 📌 Climate change 📌 National security 📌 Leadership  It is: @realDonaldTrump  @JoeBiden   Who meets your expectations? #Elections2020  @Twitter  @USATODAY,2020-10-22T22:22:48+00:00
,Twitter Web App,"@plaguespanics Act of God: The Black Plague Natural: Hurricane Maria Social: Climate change They can be hard to identify depending maybe on your personal beliefs, some people view natural disasters as God's messages to us.",2020-10-22T22:22:48+00:00
"Los Angeles, CA",Twitter for iPhone,@TricksyRaccoon Definitely was not. Mostly just agreeing with the sentiment that climate change is anti-baby for a reason personal to me and then me explaining that people still having children doesn’t matter to me. Have children if you want !,2020-10-22T22:22:47+00:00
Las Vegas,Twitter Web App,"Not to scorch anyone's mellow or anything, but not being vegan is pretty close to climate change denialism ... so it's pretty hard to be a hard-nosed scientific endorser without endorsing an almost exclusively vegan eating pattern. https://t.co/l2hKuhffnY",2020-10-22T22:22:44+00:00
"South Dakota, USA",Twitter for iPhone,@catturd2 Just like those who predict the weather and climate change.,2020-10-22T22:22:42+00:00
Sydney,Twitter for Android,Climate change deniers are our greatest threat.  China's Communist Party knows how to quell a restive population — but what about its environment? https://t.co/C9G3JuCif5,2020-10-22T22:22:38+00:00
,Twitter Web App,@senatorshoshana I can only hope that even conservatives are now overwhelming in favour of taking climate change seriously.     Seeing the young conservatives poll this way makes me Optimistic.,2020-10-22T22:22:31+00:00
"Berkeley, CA",Twitter Web App,"@IDoTheThinking @about_dave @JesseArreguin yep - Plastic bags and straws are not a climate change issue, they're a litter and water pollution issue.",2020-10-22T22:22:30+00:00
"New York, NY",Twitter Web App,@jehiah Yes! And with climate change I think there has to be tremendous pressure for this to happen now. Another year of inaction under this leadership will doom New York.,2020-10-22T22:22:27+00:00
"State College, PA",Twitter for iPhone,Panels in the COVID world. Interested in learning about #climateactivism from @Fisher_DanaR or #intergenerationallearning and #climatechange from my work? Come check out this panel with @wvpubliclands https://t.co/1GjvuXQEcz,2020-10-22T22:22:25+00:00
CA-FL-HI-OR-LV,Twitter for iPhone,"⁦Ice melt is a real concern from pole to pole for many reasons. @ScienceAlert⁩: “Ice Melt in Alaska Threatens to Unleash Unprecedented 'Mega-Tsunami', Scientists Warn.” #ClimateChange #GlobalWarming #science #ClimateEmergency #savetheplanet  https://t.co/oJ3SgQ33b2",2020-10-22T22:22:19+00:00
"Tampa, FL",Twitter Web App,This is a great initiative that will help monitor and combat the impact of climate change on our region. https://t.co/DY2aCkdIs9,2020-10-22T22:22:16+00:00
,Twitter Web App,"#CameronPeakFire #ClimateChange #GlobalWarming  The 11 biggest wildfires in Colorado history  All of the top 11 fires in state history have happened since 2002, with three of the top five happening in 2020.  https://t.co/Euu11imO8V",2020-10-22T22:22:06+00:00
,Twitter Web App,"People in their 60's are Cooing because they voted for Biden AND this is their first time voting ever. What?? Look I'm glad you voted for Biden however women's rights, education, climate change, POC rights etc.. are vitally important. WTF took you so long? No you don't get a pass",2020-10-22T22:22:00+00:00
University of Victoria,Twitter Web App,Will we be better prepared for the next global pandemic? How can COVID-19 inform strategies for tackling #ClimateChange? What profound (+ &amp; -) changes has #COVID19 made to how we do science? @NavdeepSBains @cathmckenna @KirstyDuncanMP @JonathanWNV @JustinTrudeau @cafreeland 🇨🇦 https://t.co/pNZEkRS5Et,2020-10-22T22:21:57+00:00
,Twitter Web App,"@ImpDrift letting morons restore capitalism, is letting morons, restore a system that kill 20millions person, by year. climate change not included.",2020-10-22T22:21:49+00:00
Canberra,Twitter Web App,"“Opportunities like...an inclusive and future-focused recovery, including a green recovery with an increased reliance on renewables, improved energy efficiency, addressing climate change and accelerating the transition to a lower-emissions future""  https://t.co/nrUmBveLAe",2020-10-22T22:21:49+00:00
Canada,Twitter for iPhone,"We’re blowing up on TikTok for saying we’re dating, and everyone is freaking out because they didn’t know!? I guess we should’ve made out more in our climate change videos.",2020-10-22T22:21:35+00:00
,Twitter for Android,"@jricole Chomsky regards Trump as an existential threat to the human race because of climate change, but how can Chomsky look at the milquetoast  Biden platform and think the existential threat will be removed?",2020-10-22T22:21:31+00:00
block me 100% up to you really,Twitter for iPhone,Heat-Bouncing Paint Is Latest Weapon Against Climate Change | Digital Trends https://t.co/hKNrzJxTpH,2020-10-22T22:21:31+00:00
"Colorado, USA",Twitter for iPhone,@southstands303 Absolutely. Coincidence that the west has had the worst fire season ever in an election year?  Some of it is climate change. Some of it was set or caused by humans.,2020-10-22T22:21:30+00:00
,Twitter Web App,The debunking of Global Warming Theory (anthropogenic climate change)      https://t.co/W5cLWPqBKt https://t.co/X6X6Ed0Z5h,2020-10-22T22:21:21+00:00
"New York, NY",Twitter Web App,"@projectstartrek @2AvSagas @NYC_DOT @cmenchaca @scottmstringer Yes, but a year or more is a long time to wait when the clock is ticking on climate change. Polly and Bill just aren't up to the challenge.",2020-10-22T22:21:17+00:00
"Austin, TX",Twitter Web App,"@darrennevares I think climate change actually needs to be taken more seriously than many on the left are saying, all countries must contribute to the solution especially those who pollute the most.",2020-10-22T22:21:07+00:00
"Washington, DC",Twitter Media Studio,Trump’s rejection of science is a dangerous threat to our climate. We need a president who not only acknowledges the existence of #ClimateChange but will take urgent action to fight it. https://t.co/Q3gjWjiGO8 https://t.co/AN8rg6wHJ7,2020-10-22T22:21:00+00:00
"London, England",Twitter for Android,"I'm becoming impatient with friends who ""can't deal with climate change right now"" because they have too many other things to worry about. Nothing to worry about on a dead planet. #ClimateCrisis #ClimateEmergency #ExtinctionIsForever https://t.co/Rwit4dLq2R",2020-10-22T22:20:54+00:00
,Twitter Web App,@5Kelamaty All this pronoun shit is coming from the same kinda people that are telling us to 'listen to the scientists' when it comes to climate change and covid!,2020-10-22T22:20:53+00:00
,Twitter Web App,"@AdamskiPeter @GeraldKutney @CSPGeologists The UNFCCC definition is a POLITICAL, not scientific definition. It subjectively assumes that it is GHGs from human influence on the atmosphere are dangerous and was written in 1992. The IPCC scientific definition of #climatechange makes no such assumptions or subjective claims. https://t.co/Rfdx8g3pHR",2020-10-22T22:20:51+00:00
"Whitefish, MT",Twitter Web App,"Climate change is real! Those disputing it, should go talk to the people in Grand Lake &amp; Granby, CO. It should be getting cold, and beginning to snow.  Cadence's Nana lost her home yesterday, has evacuated 3 locations in the past day. It exploded to 100k acres in just 24hrs  😭😭",2020-10-22T22:20:32+00:00
"South Carolina,  USA ",Twitter for Android,@realDonaldTrump  When ask about climate change you should tell them that it is every Americans Responsiblity to behave responsibly by managing our natural properly.,2020-10-22T22:20:28+00:00
