user_country,source,content,date
Hooray for Hollywood 🎥 ,Twitter for iPhone,"I don’t know how much of the debate I’ll get through tonight, but my ballot made it today, so I’ll definitely be getting that filled out and ready to mail tomorrow! 🗣🗳   #PresidentialDebate2020 #Vote #AbsenteeBallot https://t.co/kZyXU75Sih",2020-10-22T23:55:53+00:00
,Twitter for Android,@Yamiche @JMFDSJ Joe Biden should bring in a 4 oz. glass of water as his Debate Guest.,2020-10-22T23:55:52+00:00
"Madison, WI",Twitter Web App,@ScottWalker getting ready for tonight's debate: https://t.co/jdRGlPI5Oc,2020-10-22T23:55:52+00:00
"Bronx, NY",Twitter for iPhone,@KOSDFF Where’s the New Video? After watching the debates I need to sanitize you brain of reality!,2020-10-22T23:55:52+00:00
,Twitter for iPhone,Great phone bank before the debate tonight!!! #MAGA #LeadRight https://t.co/vAOOwK6buB,2020-10-22T23:55:52+00:00
The Federal Reserve,Twitter for iPhone,They should start the debate by having Bill Ackman scream “HELL IS COMING” into the camera. https://t.co/yvEkqpw66m,2020-10-22T23:55:51+00:00
,Twitter Web App,@JoeBiden You should make them keep the plexiglass tonight for the debate. I do not understand why you don't.,2020-10-22T23:55:51+00:00
Wherever it's quietest ,Twitter Web App,What exactly is the point of tonight's debate?,2020-10-22T23:55:51+00:00
USA,Twitter for iPhone,Where to watch the final debate between President Trump and sleepy Joe?  https://t.co/v0ZXEA6IYu of course.,2020-10-22T23:55:50+00:00
Tampa Bay,Twitter Web App,Thanks to Pres. Jeb Bartlett’s top advisor (@BradleyWhitford) for the shout-out from #thewestwing! #Debate2020 #debate https://t.co/3HQ0M7c1sU,2020-10-22T23:55:50+00:00
Tampa Bay Area,Twitter Web App,@cnnbrk Pretty stupid for trump campaign to release that much ammo before a debate.  The interview was directed at campaign propaganda and acquisitions without proof.  @realDonaldTrump and his supporters can eat the crap up but most Americans are done with his lies!,2020-10-22T23:55:50+00:00
,Twitter for iPhone,"Is there something about me that gives off a republican vibe or ....? If so please let me know so I can change it immediately.   That said, don’t talk to me about how you think Biden is peeing his pants in fear for the debate tonight. Thanks",2020-10-22T23:55:50+00:00
"Hudson Valley, New York, USA",Twitter for Android,@maurjoh15 @liberalgoddess Debate begins at 9pm. This is all pre-debate chatter.,2020-10-22T23:55:50+00:00
,Twitter for iPhone,@ArianaGrande you watching the debate?,2020-10-22T23:55:50+00:00
,Twitter Web App,I have got my bottle of wine ready!! I am ready for the debate! #BidenHarris2020,2020-10-22T23:55:50+00:00
USA,Twitter Web App,@BrickOShit @BeachSteffen @mlanger Or the Bob Woodward excerpts before the first debate...,2020-10-22T23:55:49+00:00
"Los Angeles, CA",mLabs - Gestão de Redes Sociais,Don't miss Sonali Kolhatkar post-debate analysis tonight with Thom Hartmann and Julio Ricardo Varela live on Free Speech TV starting at 7:30 pm PT / 10:30 pm ET. https://t.co/UUDNfsoVyD,2020-10-22T23:55:49+00:00
,Twitter for iPhone,"With Harris County putting up record numbers with early voting, how many of you have already voted before tonight’s final presidential debate?",2020-10-22T23:55:49+00:00
Nationwide - Based L.A. & NYC,Twitter for iPhone,Who’s winning tonight? #PresidentialDebate2020 #debates,2020-10-22T23:55:49+00:00
RTs are not endorsements. Views expressed are our own. They/Them. A better world is possible.,Twitter Web App,Here's a cspan Livestream for the debate. We'll look later for third party and Indy left responses.  https://t.co/kYbF6uqal0,2020-10-22T23:55:49+00:00
a fucked up world,Twitter for Android,FINAL DEBATE in a few minutes.... #USElections2020 #TrumpVsBiden #Biden,2020-10-22T23:55:49+00:00
,Twitter for iPhone,@seanhannity Well that’ll win him the debate. Republicans are such fools.,2020-10-22T23:55:49+00:00
"Detroit, Michigan",Twitter for iPhone,Got this debate tonight 🥴,2020-10-22T23:55:49+00:00
United States,Twitter Web App,are people really on the fence enough to watch these debates lol,2020-10-22T23:55:48+00:00
,Twitter for iPhone,"Alright debate night, should be fun to watch my fellow Americans trade insults and death threats over 2 people who have no idea who they are. Popcorn 🍿 ready",2020-10-22T23:55:48+00:00
she/her | 17 | bi | multi,Twitter for iPhone,IM SO NERVOUS FOR THIS DEBATE,2020-10-22T23:55:48+00:00
"Florida, USA",Twitter for iPhone,@TheRightMelissa @realDonaldTrump @nypost @realDonaldTrump The President needs to use his Debate time tonight to tell American people what the media won't allow them to hear about @JoeBiden Biden crime families dealings with China @realDonaldTrump @FakeNews_Buster @ABC @NBCNews,2020-10-22T23:55:48+00:00
,Twitter for iPhone,@kaitlancollins @GeraldoRivera playing the debate coach role of Chris Christie this round.,2020-10-22T23:55:48+00:00
"San Diego, CA",Twitter for Android,Debate Night Flight...let's fly together! https://t.co/cJEV4Hyxh1,2020-10-22T23:55:47+00:00
United States,Twitter for Android,Another BOOM #LaptopFromHell #BidenCrimeFamily #trump2020 #debate . https://t.co/qxHkR674Ex,2020-10-22T23:55:47+00:00
,Twitter for iPhone,"@CourtneyLofgren I’m all in on NYG-PHI early, but will tune in to the debate for more “magnificently brilliant” answers. We’ll see how much I can stomach.",2020-10-22T23:55:47+00:00
new jersey,Twitter for iPhone,“should i get us snacks for the debate?” - my father,2020-10-22T23:55:47+00:00
Basement,Twitter Web App,"Should I bet the P5 at Chucktown, the late P5 at Mobine, or watch the presidential debate? https://t.co/YEixTl6LkG",2020-10-22T23:55:47+00:00
United States,Twitter for Android,When is the stupid debate?,2020-10-22T23:55:47+00:00
,Twitter for iPad,When Trump starts the lies at debate I hope they will use the mute button.He is abscessed with lying about Biden and his Son Hunter.He needs to look at his own children.,2020-10-22T23:55:46+00:00
she/her,Twitter for iPhone,what time is the debate,2020-10-22T23:55:46+00:00
Pennsylvania ,Twitter Web App,"@ScottTruhlar If you're watching Lucy move the football and I'm watching the debate, then we're watching the same thing.",2020-10-22T23:55:46+00:00
"ÜT: 30.195185,-97.863305",Twitter for iPad,@FakeSermon The blinding arrogance to suggest that Psalms was referring to ANY English translation of the Bible is the beginning and end of the KJV Only debate for me.,2020-10-22T23:55:46+00:00
United Kingdom,Twitter for iPhone,I’m planning to watch the debate - I’ll be awake anyways  so why not - it’s gonna be a car crash I’m sure #Debates2020,2020-10-22T23:55:46+00:00
"Dallas, TX",Twitter for iPad,@dpakman Just went and early voted! Looking forward to the debate stream tonight.,2020-10-22T23:55:45+00:00
Pokimane's Twitch Chat,Twitter Web App,why arent they allowing kanye on the debate this seems kinda rigged if you ask me,2020-10-22T23:55:45+00:00
,Twitter for Android,"Is this list of final 2020 debate topics for real, seriously? https://t.co/bmfo1trp4K",2020-10-22T23:55:45+00:00
,Twitter for iPhone,"@JoeBiden For the love of the country, will someone please give trump a couple of drinks before the debate. He needs to chill.",2020-10-22T23:55:45+00:00
,Twitter for iPhone,Trailer park residents say landlord threatened to double rent if Biden wins ⁦ @morethanavote⁩ ⁦@KingJames⁩ ⁦@TheDemCoalition⁩ ⁦@DNCWarRoom ⁦@fairfightaction⁩ #debate #Trump ⁦⁩ ⁦@UniteThePoor⁩ ⁦@BlackVotersMtr⁩  https://t.co/8WaCnIkii8,2020-10-22T23:55:45+00:00
"Chicago, IL",Twitter for Android,Watching a movie about dogs at a drive-in theater with my dog &gt; watching another debate where two grown men bark at each other,2020-10-22T23:55:44+00:00
"Morgantown, WV",Hootsuite Inc.,"Watch ""WATCH LIVE: The Second 2020 Presidential Debate | Special Coverage &amp; Analysis | PBS NewsHour"" on YouTube https://t.co/2SZ3rKE82x",2020-10-22T23:55:44+00:00
Your Head,Twitter Web App,@historygirlMA We're under the most incredible active measure psyops operation campaign ever waged on this country -- contradictions and lies mixed with truth everywhere. And not one Dem leader is even talking about it. Let's just do regular debates tonight 🤤. It's all a disgrace.,2020-10-22T23:55:44+00:00
iNYourPhone,Twitter for iPhone,"@takemeaway771 @tonyschwartz I’d watch the debate, but I need to count how many sheets are left on the roll of toilet paper in the bathroom. What lousy timing",2020-10-22T23:55:44+00:00
"Long Island City, Queens",Twitter for iPhone,Preview of tonight’s debate: https://t.co/o4KaZHMbdI,2020-10-22T23:55:43+00:00
"Albany, NY",Twitter for Android,Wait.... there's another debate??,2020-10-22T23:55:43+00:00
"New York, NY",Twitter Web App,"@CaslerNoel My prediction on how the debate will go:  Biden: plans for Covid response, economic recovery, Supreme Court review, protection and expansion of ACA, and more  Trump: Blah, blah, blah, poos his diaper, anger, walks off stage",2020-10-22T23:55:43+00:00
"New York, NY",Twitter for iPhone,@igorbobic I would say watching the first ever black and Indian woman participating in a VP debate was pretty fucking memorable.,2020-10-22T23:55:43+00:00
Puerto Rico,Instagram,“Will you shut up man?” - JOE   Ready pa’l OTRO debate https://t.co/gUlaUCsXDS,2020-10-22T23:55:43+00:00
"South Carolina, USA",Twitter for Android,"So my girlfriend who never voted Democrat before today, voted for Biden. But my husband declared tonight that he might not vote. He says the VP debate really turned him off. Sigh.",2020-10-22T23:55:43+00:00
"San Francisco, CA",Twitter Web App,"Do I watch the last presidential debate, or do I heat up a spoon and scoop out my eyeballs?",2020-10-22T23:55:42+00:00
,Twitter for iPhone,"Instead of the debate, I will be watching the Brooklyn 99 Halloween episodes. https://t.co/v1f2LGXcZa",2020-10-22T23:55:42+00:00
,Twitter Web App,Former Hunter Biden associate Tony Bobulinski makes a statement ahead of the final presidential debate. President Trump is expected to bring Bobulinski as his guest to the debate. https://t.co/e8MxVVWqPS via @FacebookWatch,2020-10-22T23:55:41+00:00
,Twitter for iPhone,If this isn’t the debate tonight I don’t want it https://t.co/qjNHqd3QwH,2020-10-22T23:55:41+00:00
,Twitter for iPhone,but I’m drinking so it counts as fun debate pregaming right?,2020-10-22T23:55:41+00:00
,Twitter for iPhone,Why does sleepy Joe need to prepare for a debate if he’s been in politics for 47 years?,2020-10-22T23:55:41+00:00
"Houston, TX",Twitter for iPhone,@willmenaker @ByYourLogic His democracy now debate with Dersh is as legendary as like the Jordan flu game,2020-10-22T23:55:41+00:00
USA,Twitter for iPhone,President Trump plans to bring Hunter Biden associate Tony Bobulinski as guest to debate | Fox News  This ought to be good! https://t.co/0Sp2zWz07g,2020-10-22T23:55:41+00:00
"British Columbia, Canada",Twitter Web App,"@bevrosenbaum The first rule of This Debate Club is ""Don't enjoy This Debate Club.""",2020-10-22T23:55:41+00:00
Northern Virginia,Twitter for iPhone,I was dead sober for the first debate and the town-halls. That will not be the case tonight.,2020-10-22T23:55:41+00:00
,Twitter for iPhone,@RodyMane He always has good games but im not here to debate. You gotta have 3 to guard him. If not it’s a dunk lol,2020-10-22T23:55:40+00:00
"Minnesota, USA",Twitter for iPhone,One of the best things about voting early is not paying attention to the “debate” tonight. https://t.co/FAe7ZbzTc7,2020-10-22T23:55:40+00:00
"New Orleans, LA",Twitter for iPhone,"About to watch the final debate.  I know, I’m a glutton for punishment:)",2020-10-22T23:55:40+00:00
"Wahpeton, ND",Twitter for iPhone,Debate prediction - Trump gets mad at being muted so many times he moves and takes over Biden’s mic at some point #Debates2020,2020-10-22T23:55:40+00:00
,Twitter for iPhone,Trump invites Hunter Biden ex-associate Tony Bobulinski to final debate - YouTube https://t.co/2btZASg3jv,2020-10-22T23:55:40+00:00
"New Albany, IN",Twitter for iPad,DEBATE NIGHT: Time for the final Presidential Debate. We are all in for Vice President Joe Biden. Like and share if you agree! #BidenHarris2020 https://t.co/rngqULj0Ml,2020-10-22T23:55:40+00:00
,Twitter for Android,More Hunter Biden texts and emails emerge hours before debate https://t.co/Zii0koXyW3 @MailOnline,2020-10-22T23:55:40+00:00
,Twitter Web App,Poll on who will win tonight's debate:  Trump - 3% Biden - 34% Mute button - 63%,2020-10-22T23:55:39+00:00
"Las Vegas, NV",Twitter for iPhone,You know that Tony Bobulinski bombshell right before the debate not only rattled the Biden camp but also the debate moderation team.,2020-10-22T23:55:39+00:00
Virginia,Twitter Web App,Here are the Rules for tonight's Debate Drinking Game!  1) Just Don't. https://t.co/f3JcMWBSjm,2020-10-22T23:55:39+00:00
"Los Angeles, CA",Twitter Web App,I'm going to miss the #debates.,2020-10-22T23:55:39+00:00
Groom Lake,Twitter for Android,@VernonJordan2 @stclairashley Okay so in some warped world you think Sergeant Kid Sniffer is going to be president after everything in the past three days? If so you are delusional. Let's see what happens at the debate. It is going to be epic.,2020-10-22T23:55:38+00:00
"Toronto, ON",Twitter Web App,"Prediction for the debate: it will be boring and uneventful because of the new format, which will be counted as a win for Trump by pundits afterwards",2020-10-22T23:55:38+00:00
"Manhattan, KS",Twitter for iPhone,"I’ve already voted, and the only thing the debate could possibly do is make me angry. I’m not watching.",2020-10-22T23:55:38+00:00
PNDub,Twitter for iPhone,"Anyone else going all in on a full carb dinner for tonight’s presidential debate? Carb loading for what is surely going to be a sh*t show on steroids. Mmmm, pasta with a side of garlic cheese bread? Or mmm, calzone with a side of potato skins? 🤔🤔#PresidentialDebates2020",2020-10-22T23:55:38+00:00
"Washington, USA",Twitter for iPhone,Is go going to still debate?,2020-10-22T23:55:38+00:00
,Twitter for iPhone,"Oh god, the debate is tonight",2020-10-22T23:55:37+00:00
My beautiful mind palace. ,Twitter Web App,They replaced the debate with a surprise screening of the new Top Gun sequel,2020-10-22T23:55:37+00:00
"Charlotte, NC USA",Twitter Web App,LIVE: Final 2020 Presidential #Debate Between #Trump and #Biden at 9 PM ET @EpochTimes  https://t.co/zpGbr2qc8s,2020-10-22T23:55:37+00:00
"California, USA",Twitter for iPhone,I am watching the presidential debate still waiting for sleepy Joe Biden to answer any questions he says Trump doesn’t have a plan he says Trump isn’t making Health Care work it is his Obama care/Biden who’s premiums went up an average of $7000 per household! Is that inyourbudget,2020-10-22T23:55:37+00:00
"Jacksonville, FL",Twitter for iPhone,Reading comics while I wait for the debate that I’ll probably turn off after the first few minutes https://t.co/VfEgfMBDap,2020-10-22T23:55:37+00:00
Greater Metropolitan Bumpass,Twitter for Android,The Brownies of Mortal Sin are out of the oven. Ice cream will be applied post-haste.  The debate may commence. https://t.co/CDgmgcO5C6,2020-10-22T23:55:37+00:00
,Twitter Web App,No need to watch the debate....  Trump won before it started.  #BigGuyBiden  #TonyBobulinski https://t.co/LvmyrnEBQE,2020-10-22T23:55:36+00:00
"Pompano Beach, Florida",Twitter for Android,I wish Apple had bought the rights to the debate instead of the rights to Charlie Brown.,2020-10-22T23:55:36+00:00
United States,Blog2Social APP,"In years past, independent presidential hopefuls had a say in a their own debate settings. Read more...  #ENMNEWSPOLITICS https://t.co/QSM0sUEL2q https://t.co/P0wILPrPDf",2020-10-22T23:55:36+00:00
"Chicago, IL",Twitter for iPhone,I love debate night because he can’t tweet and lie at the same time.,2020-10-22T23:55:36+00:00
First class on an airplane,Twitter for iPhone,There’s a debate tonight? https://t.co/g859Zc76GV,2020-10-22T23:55:36+00:00
,Twitter for iPhone,Watch the debate moderator not ask a single question on this https://t.co/XRszJKETEq,2020-10-22T23:55:36+00:00
Internet,Twitter for iPhone,Are you ready for some Presidential Debate? https://t.co/ZKEo1I1tpP,2020-10-22T23:55:36+00:00
Atlanta,Twitter Web App,🔴 WATCH LIVE: Final 2020 Presidential Debate LIVE Coverage- Trump vs. Bi... https://t.co/31Z3nxWVDU via @YouTube,2020-10-22T23:55:36+00:00
"1.8 MHz thru 24,192.1 MHz",Twitter for Android,@d4rkm4tter @DAkacki But the debate is on tonight!,2020-10-22T23:55:36+00:00
New York & Toronto,Twitter Web App,It's a sad state when we're all set to watch the President of the US engage in a debate with his political rival.  And millions will be disappointed if POTUS isn't a complete train wreck.,2020-10-22T23:55:36+00:00
"Oregon, USA",Twitter for Android,@brycetache After the first few minutes of the first debate I just brought out the whole wine bottle to keep filling my glass!,2020-10-22T23:55:35+00:00
"California, USA",Twitter for iPhone,Please tell me y’all are watching the debate tonight?,2020-10-22T23:55:35+00:00
"PA, NYC",Twitter for iPhone,F*ck a debate let them square up.,2020-10-22T23:55:34+00:00
,Twitter Web App,@itsJeffTiedrich Imagine a debate that has been modified to deal with your unbearable tendency to interrupt other people.,2020-10-22T23:55:34+00:00
,Twitter for Android,Check out Biden vs. Trump! Final Presidential Debate | Trump Jr. &amp; Ted Cruz Guest | 10/22/20 on Blaze TV: https://t.co/VaAOlVIA0Q,2020-10-22T23:55:34+00:00
,Twitter Web App,"@ThePlumLineGS Biden just say...OMG, is this your pizza gate?  Please, I know it can be hard Donald, but let's keep focused on the debate.",2020-10-22T23:55:34+00:00
"Charlotte, NC",Twitter for iPhone,Debate Night!!! Go Joe Go!!! #TrumpIsPathetic #Debates2020,2020-10-22T23:55:33+00:00
,Twitter for iPhone,"@FoxNews You know what’s troubling? Trump is going to try to make this an issue in tonight’s debate. But the American an people are more worried about what impacts their lives: COVID, economy, disinformation and social disruption. Cover what matters, please!",2020-10-22T23:55:33+00:00
los angeles,Twitter for iPhone,"Final presidential debate in 5 mins. Let’s do this. SWEEP THE FLOOR, BIDEN! #PresidentialDebate2020 #vote #VoteBlue",2020-10-22T23:55:33+00:00
Home on the Range,Twitter for iPhone,Projection for tonight’s debate... https://t.co/qUwhRoBM1p,2020-10-22T23:55:32+00:00
"Fairfax, VA",Twitter for Android,This debate is less a head to head and more of a head to ass.   #PresidentialDebate2020,2020-10-22T23:55:32+00:00
"Resistance, USA",Twitter Web App,@ThomboyD You know what's sad though. If the idiot manages to keep his trap shut he will be credited with having a great debate by the complicit media.,2020-10-22T23:55:32+00:00
Province of Ontario  Canada,Twitter Web App,"The debate?! Well, given the history and behavior of  the Donald aka POTUS his lack of control will be borne out in full tonight  he might become  even more unhinged  than ever.  This debate setting and what surrounds it by way of issues and rules is his true nemesis. Stay tuned!",2020-10-22T23:55:32+00:00
"Northport, NY",Twitter Web App,All the Surprise Guests Trump May Bring to Thursday’s Debate https://t.co/QxBCNf20H7 via @intelligencer,2020-10-22T23:55:32+00:00
,Twitter for iPhone,I’m glad the presidential debate is competing only with Eagles Vs Giants. 😂,2020-10-22T23:55:32+00:00
,Twitter for iPhone,"Well...I’ve decided to be sad while watching #TRUMP2020ToSaveAmerica debate tonight while eating my 12$ ice cream from my $15,000 freezer 😂 😂 Not! I’m in my nice warm jammies, on my comfy couch with a bowl of the most buttery popcorn EVER! Mmmm #DemocratsAreDestroyingAmerica https://t.co/JqADZeRLbq",2020-10-22T23:55:32+00:00
"Holmdel, NJ",Twitter for iPad,"@TeamTrump Someone listen to what Robert O’Brian, National Security Advisor just said on Fox News he hoped Pres Trump would hit on in tonight’s debate. About a one minute quick direct listing of POTUS’s security achievements. Get this to Trump now for debate.",2020-10-22T23:55:31+00:00
"Charlotte, NC",Twitter for iPad,"@ehax12 Lmaoo the last debate was a mess, I’m just watching in case another fly makes an appearance",2020-10-22T23:55:31+00:00
,Twitter for iPhone,"Today more than ever, we’re proud to support Joe Biden for president.   For tonight’s debate, we’re offering our #BidenHarris2020 shirts for 20% off with the promo code: JOEBIDEN  Wear your message loud and proud!  https://t.co/mbUJd9pWj6  #DebateTonight #Debate2020 https://t.co/D4d0y8G0Rk",2020-10-22T23:55:30+00:00
"Boston, MA",Twitter Web App,Me about the debate: https://t.co/VNy0Hv7SWC,2020-10-22T23:55:30+00:00
Third Rock From The Sun,Twitter for Android,Not @donnabrazile! Nooo!!!! I would like to watch the debate but I have to turn this channel now. @FoxNews #Debate2020 https://t.co/HT0HZW94Fa,2020-10-22T23:55:30+00:00
,Twitter for iPhone,More Hunter Biden texts and emails emerge hours before debate  https://t.co/NkGBFBkKiM,2020-10-22T23:55:29+00:00
District of Columbia,Twitter for iPhone,The debate gonna be a game time decision for me. Idk if I have the mental capacity for them tonight lol,2020-10-22T23:55:29+00:00
"Phoenix, AZ",Twitter for iPhone,@FantasyPros Fans don’t change to the debate and watch this game.,2020-10-22T23:55:28+00:00
,Twitter Web App,@MelodyGirl64 Bringing him to the debate should be a big diversion for Biden!,2020-10-22T23:55:28+00:00
"Moorhead, MN",Twitter for Android,I am more excited for the mute button tonight. #debate,2020-10-22T23:55:28+00:00
the madhouse,Twitter for Android,Everyone got there debate drinks ready!? I'm on my 3rd glass of wine already!,2020-10-22T23:55:28+00:00
Planet Earth,Twitter for Android,"@brain_warrior @ChanelRion @NEWS_MAKER @OANN @NeonNettle He could have done this 3 months ago or even 3 days ago. you have to be asking yourself why did he wait until an hour and a half before the debate.  Fine, let the FBI look at it...the election might have to be delayed.",2020-10-22T23:55:27+00:00
,Twitter for iPhone,Trump just handed Biden a devastating debate attack https://t.co/PqZlOAcz4w,2020-10-22T23:55:27+00:00
,Twitter for iPhone,This better be the last debate.  #debatedogs https://t.co/EfZwv5ONBq,2020-10-22T23:55:27+00:00
"Toronto, Ontario",Twitter for iPhone,It’s date night but the debate is on and your dating a journalist hmmmmm,2020-10-22T23:55:27+00:00
"Salt Lake City, UT",Twitter Web App,@ErinMoriarty_ 50) Garage Band... I made everything on Garage Band... I played a lot of good music... but it was all in the moment and it's all gone because I didn't record it.  I could play again but to play alone... and have something... it's just fucking depressing. How long until the debate,2020-10-22T23:55:27+00:00
"Westland, MI",Twitter for iPhone,Wish I had some snacks for this entertaining ass debate tonight 😂,2020-10-22T23:55:27+00:00
,Twitter Web App,Who will win tonights debate?  President Trump  Or  The guy CHINA paid for  ????,2020-10-22T23:55:27+00:00
"Birmingham, AL",Twitter Web App,Let me prepare my mind for this debate 🤦🏽‍♀️,2020-10-22T23:55:27+00:00
"Calgary, Alberta",Twitter for iPhone,"“Gird up your loins” seems both like a strange saying, but also an appropriate warning to all those considering watching tonight’s debate.",2020-10-22T23:55:27+00:00
South of Heaven,Twitter for Android,"Expect to have many ""Jerk Store"" moments after the #PresidentialDebate2020. Its okay. Debates arent nearly as influential as they were decades ago.  #SeinfeldReference",2020-10-22T23:55:27+00:00
"Austin, TX",Twitter Web App,"Prediction for tonight's debate: After Trump gets muted for the 2nd time, he will walk off the stage. #Debates2020",2020-10-22T23:55:26+00:00
Para comer: Lugo,Twitter Web App,"1,197 Active Fires! and those two are going to debate what? #VoteHimOut2020 https://t.co/7ANFMRYH4y",2020-10-22T23:55:26+00:00
"Houston, TX",Twitter for iPhone,Damn I forgot about the debate.,2020-10-22T23:55:26+00:00
New York,Twitter for iPhone,Both the debate and the football game have the potential to end up like this https://t.co/X5ooBnSWle https://t.co/0I5bopM0L5,2020-10-22T23:55:26+00:00
Norge,Twitter Web App,"@Sarma_Aalia Because time is relative, indicating that you will debate him in the future until all mentioned numbers are correct.",2020-10-22T23:55:26+00:00
"Chicago, IL",Twitter for iPhone,instead of watching the debate I plan to keep watching this sex cult documentary ✌🏼,2020-10-22T23:55:26+00:00
mike.acker1@gmail.com,Twitter for iPhone,"It’s a long shot and a real gamble, but I think Trump can win the final debate and secure his re-election if he decides tonight to endorse Joe Biden.",2020-10-22T23:55:26+00:00
"Portland, Oregon",Twitter Web App,JFC @debates WHY are you caving? Protect @JoeBiden with plexiglass &amp; let King Baby stand there without his if he wants to be a selfish asshole. But he doesn't get to make this choice for Joe too #PresidentialDebate2020 @SymoneDSanders https://t.co/jS6C9Cg4Gx,2020-10-22T23:55:25+00:00
Breaking News everywhere,Twitter for iPad,More Hunter Biden texts and emails emerge hours before debate  https://t.co/2d9i3ndy33,2020-10-22T23:55:25+00:00
"Los Angeles, CA",Twitter for iPhone,Prepping for tonight’s Presidential debate like: https://t.co/MO9XTTiND9,2020-10-22T23:55:25+00:00
,Twitter for iPhone,Re: the debate pls wake me if Trump falls off the stage or they address the fact that both stars of the movie Fever Pitch now host talk shows,2020-10-22T23:55:24+00:00
"Clemson, SC",Twitter for iPhone,Who do you expect to win tonight’s debate? #Debates2020,2020-10-22T23:55:24+00:00
